Product URL,Product Name,Product Price,Rating,Number of reviews,Manufacturer,ASIN,processed_text
https://www.amazon.in/Skybags-Brat-Black-Casual-Backpack/dp/B08Z1HHHTD/ref=sr_1_1?crid=2M096C61O4MLT&dib=eyJ2IjoiMSJ9.NdOKhzTWp5YJqrnZWmusO4EprR1ofj5Z97vQjZseKmPfrMKZqaeL5SJLRiWHdXjq8wAmh16TqMVgAN3I0vHLky516GAXycnrG6X5Fliubfac_fS8ZN7kILF7G8Zt0XTS7g6A_QKNwNi18RBsn90L2axPlrqswkWgnjzOKZ8ZwDIPq9BmYXidLvZKG0bZGEkW-4BHQdAq8C5nSk9iXqdYYJOZBXlSXDJVpKY_P2JfVoI.bHF5q_9iQZ8RLHKocB5lilZ14C39nDytAjtKhzCxWDI&dib_tag=se&keywords=bags&qid=1727240788&sprefix=ba%2Caps%2C283&sr=8-1,"Skybags Casual Backpack 28L, 2 Main Compartments, Bottle Pocket, Front Pocket, Padded Shoulder Strap",₹446,4.1 out of 5 stars,"13,311",VIP Industries Ltd,B08Z1HHHTD,skybags casual backpack 28l 2 main compartment bottle pocket front pocket padded shoulder strap
https://www.amazon.in/Number-Backpack-Compartment-Charging-Organizer/dp/B09VTDMRY7/ref=sr_1_2?crid=2M096C61O4MLT&dib=eyJ2IjoiMSJ9.NdOKhzTWp5YJqrnZWmusO4EprR1ofj5Z97vQjZseKmPfrMKZqaeL5SJLRiWHdXjq8wAmh16TqMVgAN3I0vHLky516GAXycnrG6X5Fliubfac_fS8ZN7kILF7G8Zt0XTS7g6A_QKNwNi18RBsn90L2axPlrqswkWgnjzOKZ8ZwDIPq9BmYXidLvZKG0bZGEkW-4BHQdAq8C5nSk9iXqdYYJOZBXlSXDJVpKY_P2JfVoI.bHF5q_9iQZ8RLHKocB5lilZ14C39nDytAjtKhzCxWDI&dib_tag=se&keywords=bags&qid=1727240788&sprefix=ba%2Caps%2C283&sr=8-2,"FUR JADEN Anti Theft Number Lock Backpack Bag with 15.6 Inch Laptop Compartment, USB Charging Port & Organizer Pocket for Men Women Boys Girls",₹699,4.4 out of 5 stars,"15,425","FUR JADEN, Fur Jaden, 3C Jai Hind Bld, Dr AM Road, Bhuleshwar, Mumbai 400002",B09VTDMRY7,fur jaden anti theft number lock backpack bag 15 6 inch laptop compartment usb charging port organizer pocket men woman boy girl
https://www.amazon.in/Wesley-Raincover-Internal-Organiser-Backpack/dp/B0D37BRN7X/ref=sr_1_3?crid=2M096C61O4MLT&dib=eyJ2IjoiMSJ9.NdOKhzTWp5YJqrnZWmusO4EprR1ofj5Z97vQjZseKmPfrMKZqaeL5SJLRiWHdXjq8wAmh16TqMVgAN3I0vHLky516GAXycnrG6X5Fliubfac_fS8ZN7kILF7G8Zt0XTS7g6A_QKNwNi18RBsn90L2axPlrqswkWgnjzOKZ8ZwDIPq9BmYXidLvZKG0bZGEkW-4BHQdAq8C5nSk9iXqdYYJOZBXlSXDJVpKY_P2JfVoI.bHF5q_9iQZ8RLHKocB5lilZ14C39nDytAjtKhzCxWDI&dib_tag=se&keywords=bags&qid=1727240788&sprefix=ba%2Caps%2C283&sr=8-3,Wesley Spartan Unisex Travel Hiking Laptop Bag fits Upto 17.3 inch with Raincover and Internal Organiser Backpack Rucksack College Backpack,₹549,4.1 out of 5 stars,"2,799","Wesley, Longani Trading Company",B0D37BRN7X,wesley spartan unisex travel hiking laptop bag fit upto 17 3 inch raincover internal organiser backpack rucksack college backpack
https://www.amazon.in/Gear-Black-Laptop-Backpack-LBPASPIRE0104/dp/B075MK4TXP/ref=sr_1_4?crid=2M096C61O4MLT&dib=eyJ2IjoiMSJ9.NdOKhzTWp5YJqrnZWmusO4EprR1ofj5Z97vQjZseKmPfrMKZqaeL5SJLRiWHdXjq8wAmh16TqMVgAN3I0vHLky516GAXycnrG6X5Fliubfac_fS8ZN7kILF7G8Zt0XTS7g6A_QKNwNi18RBsn90L2axPlrqswkWgnjzOKZ8ZwDIPq9BmYXidLvZKG0bZGEkW-4BHQdAq8C5nSk9iXqdYYJOZBXlSXDJVpKY_P2JfVoI.bHF5q_9iQZ8RLHKocB5lilZ14C39nDytAjtKhzCxWDI&dib_tag=se&keywords=bags&qid=1727240788&sprefix=ba%2Caps%2C283&sr=8-4,Gear Aspire 30L Medium Water Restant Office Laptop Backpack /Backpack for Men/Women (Black),₹898,4.3 out of 5 stars,"8,587","Gear Merchandise PVT LTD, Gear Merchandise PVT LTD E/12 West Chowbaga Gulshan colony KoLkata-700100 Contact 9830403366",B075MK4TXP,gear aspire 30l medium water restant office laptop backpack backpack men woman black
https://www.amazon.in/Safari-Laptop-Backpack-Raincover-college/dp/B097JJ2CK6/ref=sr_1_5?crid=2M096C61O4MLT&dib=eyJ2IjoiMSJ9.NdOKhzTWp5YJqrnZWmusO4EprR1ofj5Z97vQjZseKmPfrMKZqaeL5SJLRiWHdXjq8wAmh16TqMVgAN3I0vHLky516GAXycnrG6X5Fliubfac_fS8ZN7kILF7G8Zt0XTS7g6A_QKNwNi18RBsn90L2axPlrqswkWgnjzOKZ8ZwDIPq9BmYXidLvZKG0bZGEkW-4BHQdAq8C5nSk9iXqdYYJOZBXlSXDJVpKY_P2JfVoI.bHF5q_9iQZ8RLHKocB5lilZ14C39nDytAjtKhzCxWDI&dib_tag=se&keywords=bags&qid=1727240788&sprefix=ba%2Caps%2C283&sr=8-5,"Safari Casual backpack 3 compartments, front pocket, bottle holder, School bags for boys & girls, College bag for women and men",₹729,4.0 out of 5 stars,"3,041","Safari, Safari Industries Ltd 301/302, A-Wing, The Qube, M.V.Road, Marol, Andheri(East), Near international Airport Mumbai- 400059 +91-22-40381851/838",B097JJ2CK6,safari casual backpack 3 compartment front pocket bottle holder school bag boy girl college bag woman men
https://www.amazon.in/MEDLER-Aquiver-litres-Waterproof-Strolley/dp/B09V8BDX1N/ref=sr_1_6?crid=2M096C61O4MLT&dib=eyJ2IjoiMSJ9.NdOKhzTWp5YJqrnZWmusO4EprR1ofj5Z97vQjZseKmPfrMKZqaeL5SJLRiWHdXjq8wAmh16TqMVgAN3I0vHLky516GAXycnrG6X5Fliubfac_fS8ZN7kILF7G8Zt0XTS7g6A_QKNwNi18RBsn90L2axPlrqswkWgnjzOKZ8ZwDIPq9BmYXidLvZKG0bZGEkW-4BHQdAq8C5nSk9iXqdYYJOZBXlSXDJVpKY_P2JfVoI.bHF5q_9iQZ8RLHKocB5lilZ14C39nDytAjtKhzCxWDI&dib_tag=se&keywords=bags&qid=1727240788&sprefix=ba%2Caps%2C283&sr=8-6,M MEDLER Aquiver Nylon 55 litres Waterproof Strolley Duffle Bag- 2 Wheels - Luggage Bag (Beige),₹428,3.4 out of 5 stars,422,"BREGGABOG INDIA PRIVATE LIMITED, breggabog@gmail.com",B09V8BDX1N,medler aquiver nylon 55 litre waterproof strolley duffle bag 2 wheel luggage bag beige
https://www.amazon.in/Craftwood-Backpack-Waterproof-Aesthetic-Backpacks/dp/B0D58K1N5M/ref=sr_1_7?crid=2M096C61O4MLT&dib=eyJ2IjoiMSJ9.NdOKhzTWp5YJqrnZWmusO4EprR1ofj5Z97vQjZseKmPfrMKZqaeL5SJLRiWHdXjq8wAmh16TqMVgAN3I0vHLky516GAXycnrG6X5Fliubfac_fS8ZN7kILF7G8Zt0XTS7g6A_QKNwNi18RBsn90L2axPlrqswkWgnjzOKZ8ZwDIPq9BmYXidLvZKG0bZGEkW-4BHQdAq8C5nSk9iXqdYYJOZBXlSXDJVpKY_P2JfVoI.bHF5q_9iQZ8RLHKocB5lilZ14C39nDytAjtKhzCxWDI&dib_tag=se&keywords=bags&qid=1727240788&sprefix=ba%2Caps%2C283&sr=8-7,"Craftwood School Backpack for Teen Girls, Boys Waterproof High School Backpack for Student Bookbag College Backpack for Women Men Casual Daypack Travel Aesthetic Backpacks Black",₹699,3.0 out of 5 stars,37,"Debonair International,GC-112A,Factory Lane,New Delhi-110044, 011-41652625",B0D58K1N5M,craftwood school backpack teen girl boy waterproof high school backpack student bookbag college backpack woman men casual daypack travel aesthetic backpack black
https://www.amazon.in/Safari-Laptop-Backpack-Raincover-college/dp/B097JH4V5G/ref=sr_1_8?crid=2M096C61O4MLT&dib=eyJ2IjoiMSJ9.NdOKhzTWp5YJqrnZWmusO4EprR1ofj5Z97vQjZseKmPfrMKZqaeL5SJLRiWHdXjq8wAmh16TqMVgAN3I0vHLky516GAXycnrG6X5Fliubfac_fS8ZN7kILF7G8Zt0XTS7g6A_QKNwNi18RBsn90L2axPlrqswkWgnjzOKZ8ZwDIPq9BmYXidLvZKG0bZGEkW-4BHQdAq8C5nSk9iXqdYYJOZBXlSXDJVpKY_P2JfVoI.bHF5q_9iQZ8RLHKocB5lilZ14C39nDytAjtKhzCxWDI&dib_tag=se&keywords=bags&qid=1727240788&sprefix=ba%2Caps%2C283&sr=8-8,"Safari Casual backpack 3 compartments, front pocket, bottle holder, School bags for boys & girls, College bag for women and men",₹699,4.0 out of 5 stars,"3,041","Safari, Safari Industries Ltd 301/302, A-Wing, The Qube, M.V.Road, Marol, Andheri(East), Near international Airport Mumbai- 400059 +91-22-40381851/838",B097JH4V5G,safari casual backpack 3 compartment front pocket bottle holder school bag boy girl college bag woman men
https://www.amazon.in/Impulse-EmpowerElite-Resistant-Backpack-Grey/dp/B0CSYYSWJR/ref=sr_1_9?crid=2M096C61O4MLT&dib=eyJ2IjoiMSJ9.NdOKhzTWp5YJqrnZWmusO4EprR1ofj5Z97vQjZseKmPfrMKZqaeL5SJLRiWHdXjq8wAmh16TqMVgAN3I0vHLky516GAXycnrG6X5Fliubfac_fS8ZN7kILF7G8Zt0XTS7g6A_QKNwNi18RBsn90L2axPlrqswkWgnjzOKZ8ZwDIPq9BmYXidLvZKG0bZGEkW-4BHQdAq8C5nSk9iXqdYYJOZBXlSXDJVpKY_P2JfVoI.bHF5q_9iQZ8RLHKocB5lilZ14C39nDytAjtKhzCxWDI&dib_tag=se&keywords=bags&qid=1727240788&sprefix=ba%2Caps%2C283&sr=8-9,Impulse EmpowerElite 25L Unisex Water Resistant Travel Laptop Backpack with USB Charging Port/Office Bag/School Bag/College Bag/Business Bag Fits Up to 16 Inch Laptop with 1 Year Warranty (Blue),₹545,3.9 out of 5 stars,274,"Impulse Travel Gears Private Limited, Impulse Travel Gears Private Limited - Whatsapp - +91 9899670867",B0CSYYSWJR,impulse empowerelite 25l unisex water resistant travel laptop backpack usb charging port office bag school bag college bag business bag fit 16 inch laptop 1 year warranty blue
https://www.amazon.in/Ezee-Garbage-Bag-inches-Pieces/dp/B06VX8YR6Q/ref=sr_1_10?crid=2M096C61O4MLT&dib=eyJ2IjoiMSJ9.NdOKhzTWp5YJqrnZWmusO4EprR1ofj5Z97vQjZseKmPfrMKZqaeL5SJLRiWHdXjq8wAmh16TqMVgAN3I0vHLky516GAXycnrG6X5Fliubfac_fS8ZN7kILF7G8Zt0XTS7g6A_QKNwNi18RBsn90L2axPlrqswkWgnjzOKZ8ZwDIPq9BmYXidLvZKG0bZGEkW-4BHQdAq8C5nSk9iXqdYYJOZBXlSXDJVpKY_P2JfVoI.bHF5q_9iQZ8RLHKocB5lilZ14C39nDytAjtKhzCxWDI&dib_tag=se&keywords=bags&qid=1727240788&sprefix=ba%2Caps%2C283&sr=8-10,Ezee Black Garbage Bags for Dustbin | 90 Pcs | Medium 19 X 21 Inches | 30 Pcs x Pack of 3,₹199,4.2 out of 5 stars,"33,523","Alka Lifestyles Pvt Ltd, Alka Lifestyles Pvt Ltd,202 Everest Chamber,2nd flr,Marol Naka,Andheri east,Mumbai-400059; Tel: +91-22 4520 3000",B06VX8YR6Q,ezee black garbage bag dustbin 90 pc medium 19 x 21 inch 30 pc x pack 3
https://www.amazon.in/BIGBERRY-Backpack-Multiple-Compartments-organiser/dp/B0CQRBBWP3/ref=sr_1_11?crid=2M096C61O4MLT&dib=eyJ2IjoiMSJ9.NdOKhzTWp5YJqrnZWmusO4EprR1ofj5Z97vQjZseKmPfrMKZqaeL5SJLRiWHdXjq8wAmh16TqMVgAN3I0vHLky516GAXycnrG6X5Fliubfac_fS8ZN7kILF7G8Zt0XTS7g6A_QKNwNi18RBsn90L2axPlrqswkWgnjzOKZ8ZwDIPq9BmYXidLvZKG0bZGEkW-4BHQdAq8C5nSk9iXqdYYJOZBXlSXDJVpKY_P2JfVoI.bHF5q_9iQZ8RLHKocB5lilZ14C39nDytAjtKhzCxWDI&dib_tag=se&keywords=bags&qid=1727240788&sprefix=ba%2Caps%2C283&sr=8-11,BIGBERRY Newage Rodeo 28 Ltrs leatherite/faux leather Backpack with Multiple Compartments & organiser,₹791,4.1 out of 5 stars,293,"EVON ENTERPRISES, 8595758076",B0CQRBBWP3,bigberry newage rodeo 28 ltrs leatherite faux leather backpack multiple compartment organiser
https://www.amazon.in/SAFARI-Ltrs-Casual-Backpack-DAYPACKNEO15CBSEB/dp/B07Q7CNPMV/ref=sr_1_12?crid=2M096C61O4MLT&dib=eyJ2IjoiMSJ9.NdOKhzTWp5YJqrnZWmusO4EprR1ofj5Z97vQjZseKmPfrMKZqaeL5SJLRiWHdXjq8wAmh16TqMVgAN3I0vHLky516GAXycnrG6X5Fliubfac_fS8ZN7kILF7G8Zt0XTS7g6A_QKNwNi18RBsn90L2axPlrqswkWgnjzOKZ8ZwDIPq9BmYXidLvZKG0bZGEkW-4BHQdAq8C5nSk9iXqdYYJOZBXlSXDJVpKY_P2JfVoI.bHF5q_9iQZ8RLHKocB5lilZ14C39nDytAjtKhzCxWDI&dib_tag=se&keywords=bags&qid=1727240788&sprefix=ba%2Caps%2C283&sr=8-12,Safari Small Size 15 Ltrs Unisex Standard Backpack - Sea Blue,₹199,4.0 out of 5 stars,"23,249","Safari Industries (India) Ltd, Safari Industries Ltd 301/302, A-Wing, The Qube, M.V.Road, Marol, Andheri(East), Near international Airport Mumbai- 400059 +91-22-40381851/838",B07Q7CNPMV,safari small size 15 ltrs unisex standard backpack sea blue
https://www.amazon.in/Safari-Backpack-Raincover-compartments-organizer/dp/B097JM3NX5/ref=sr_1_13?crid=2M096C61O4MLT&dib=eyJ2IjoiMSJ9.NdOKhzTWp5YJqrnZWmusO4EprR1ofj5Z97vQjZseKmPfrMKZqaeL5SJLRiWHdXjq8wAmh16TqMVgAN3I0vHLky516GAXycnrG6X5Fliubfac_fS8ZN7kILF7G8Zt0XTS7g6A_QKNwNi18RBsn90L2axPlrqswkWgnjzOKZ8ZwDIPq9BmYXidLvZKG0bZGEkW-4BHQdAq8C5nSk9iXqdYYJOZBXlSXDJVpKY_P2JfVoI.bHF5q_9iQZ8RLHKocB5lilZ14C39nDytAjtKhzCxWDI&dib_tag=se&keywords=bags&qid=1727240788&sprefix=ba%2Caps%2C283&sr=8-13,"Safari Casual backpack 3 compartments, front pocket, bottle holder, School bags for boys & girls, College bag for women and men",₹799,4.0 out of 5 stars,"3,041","Safari, Safari Industries Ltd 301/302, A-Wing, The Qube, M.V.Road, Marol, Andheri(East), Near international Airport Mumbai- 400059 +91-22-40381851/838",B097JM3NX5,safari casual backpack 3 compartment front pocket bottle holder school bag boy girl college bag woman men
https://www.amazon.in/Gear-Vintage2-Leather-Backpack-LBPVG2LTH0201/dp/B07G4D13L7/ref=sr_1_14?crid=2M096C61O4MLT&dib=eyJ2IjoiMSJ9.NdOKhzTWp5YJqrnZWmusO4EprR1ofj5Z97vQjZseKmPfrMKZqaeL5SJLRiWHdXjq8wAmh16TqMVgAN3I0vHLky516GAXycnrG6X5Fliubfac_fS8ZN7kILF7G8Zt0XTS7g6A_QKNwNi18RBsn90L2axPlrqswkWgnjzOKZ8ZwDIPq9BmYXidLvZKG0bZGEkW-4BHQdAq8C5nSk9iXqdYYJOZBXlSXDJVpKY_P2JfVoI.bHF5q_9iQZ8RLHKocB5lilZ14C39nDytAjtKhzCxWDI&dib_tag=se&keywords=bags&qid=1727240788&sprefix=ba%2Caps%2C283&sr=8-14,Gear Vintage2 28L Medium Faux Leather Water Resistant Anti Theft Laptop Backpack/Office Backpack for Men/Women - Brown,₹899,4.3 out of 5 stars,"13,312","Gear Merchandise PVT LTD, Gear Merchandise PVT LTD E/12 West Chowbaga Gulshan colony KoLkata-700100 Contact 9830403366",B07G4D13L7,gear vintage2 28l medium faux leather water resistant anti theft laptop backpack office backpack men woman brown
https://www.amazon.in/TRUE-HUMAN-Anti-Theft-backpack-charging/dp/B09QJ7ZF2Y/ref=sr_1_15?crid=2M096C61O4MLT&dib=eyJ2IjoiMSJ9.NdOKhzTWp5YJqrnZWmusO4EprR1ofj5Z97vQjZseKmPfrMKZqaeL5SJLRiWHdXjq8wAmh16TqMVgAN3I0vHLky516GAXycnrG6X5Fliubfac_fS8ZN7kILF7G8Zt0XTS7g6A_QKNwNi18RBsn90L2axPlrqswkWgnjzOKZ8ZwDIPq9BmYXidLvZKG0bZGEkW-4BHQdAq8C5nSk9iXqdYYJOZBXlSXDJVpKY_P2JfVoI.bHF5q_9iQZ8RLHKocB5lilZ14C39nDytAjtKhzCxWDI&dib_tag=se&keywords=bags&qid=1727240788&sprefix=ba%2Caps%2C283&sr=8-15,TRUE HUMAN EMPEROR® Anti-Theft Bagkpack With USB Charging Port Laptop bag/Office bag/College bag/Travel bag with Anti -Theft back pocket (LEGEND),₹615,3.8 out of 5 stars,"3,701","Rama luxury store, Rama luxury store",B09QJ7ZF2Y,true human emperor anti theft bagkpack usb charging port laptop bag office bag college bag travel bag anti theft back pocket legend
https://www.amazon.in/Lenovo-15-6-Inches-Everyday-Backpack/dp/B08R7RPVJF/ref=sr_1_16?crid=2M096C61O4MLT&dib=eyJ2IjoiMSJ9.NdOKhzTWp5YJqrnZWmusO4EprR1ofj5Z97vQjZseKmPfrMKZqaeL5SJLRiWHdXjq8wAmh16TqMVgAN3I0vHLky516GAXycnrG6X5Fliubfac_fS8ZN7kILF7G8Zt0XTS7g6A_QKNwNi18RBsn90L2axPlrqswkWgnjzOKZ8ZwDIPq9BmYXidLvZKG0bZGEkW-4BHQdAq8C5nSk9iXqdYYJOZBXlSXDJVpKY_P2JfVoI.bHF5q_9iQZ8RLHKocB5lilZ14C39nDytAjtKhzCxWDI&dib_tag=se&keywords=bags&qid=1727240788&sprefix=ba%2Caps%2C283&sr=8-16,"Lenovo 15.6"" (39.62cm) Slim Everyday Backpack, Made in India, Compact, Water-resistant, Organized storage:Laptop sleeve,tablet pocket,front workstation,2-side pockets,Padded adjustable shoulder straps",₹649,4.3 out of 5 stars,"10,251",‎Lenovo,B08R7RPVJF,lenovo 15 6 39 62cm slim everyday backpack made india compact water resistant organized storage laptop sleeve tablet pocket front workstation 2 side pocket padded adjustable shoulder strap
https://www.amazon.in/Murano-Casual-daybackpack-Office-College/dp/B0BX9GLFD6/ref=sr_1_17?crid=2M096C61O4MLT&dib=eyJ2IjoiMSJ9.2s_4bINTAemBCixN4hvgAOOEDzri6aAEYls2gCVSseprUgztvIXajFCCZqLsR_OM_WQWzkwOnJFWCVXOeNBPVIX_tR3SBowUSYwtMTYc83cTwpXIiRGS0pUida4GI0UmJfr6qe_iAtVptL9CJsiUIWgZLG8EPGZ99vPM3SRrgO7fCzRca1Ou0ehMhbH6uJeXtr9jDhVxZhl5hx0_1CRZsGqbq-N3Sl6KEsjZyaSjHAc.uEX8opygUHrq-kSt91A9UdNu7aO66gpv0mGqZB0PZKk&dib_tag=se&keywords=bags&qid=1727240854&sprefix=ba%2Caps%2C283&sr=8-17,Murano Louis 10ltr Small Casual day backpack/Office Bag | Travel Bag | School Bag | College Bag | Versatile bag For Men & Women |For Girl & Boy (Dark grey),₹199,3.7 out of 5 stars,745,‎Avon Lifestyle Pvt Ltd,B0BX9GLFD6,murano louis 10ltr small casual day backpack office bag travel bag school bag college bag versatile bag men woman girl boy dark grey
https://www.amazon.in/Safari-Backpack-Resistant-Polyester-Travelling/dp/B09B29F66W/ref=sr_1_18?crid=2M096C61O4MLT&dib=eyJ2IjoiMSJ9.2s_4bINTAemBCixN4hvgAOOEDzri6aAEYls2gCVSseprUgztvIXajFCCZqLsR_OM_WQWzkwOnJFWCVXOeNBPVIX_tR3SBowUSYwtMTYc83cTwpXIiRGS0pUida4GI0UmJfr6qe_iAtVptL9CJsiUIWgZLG8EPGZ99vPM3SRrgO7fCzRca1Ou0ehMhbH6uJeXtr9jDhVxZhl5hx0_1CRZsGqbq-N3Sl6KEsjZyaSjHAc.uEX8opygUHrq-kSt91A9UdNu7aO66gpv0mGqZB0PZKk&dib_tag=se&keywords=bags&qid=1727240854&sprefix=ba%2Caps%2C283&sr=8-18,Safari Flash Medium 26L Water Resistant Polyester Casual Standard Backpack - Black,₹639,3.8 out of 5 stars,"1,978","Safari Industries, 302-303, A Wing, The Qube CTS No.1498, A/2, Sir Mathuradas Vasanji Rd, Marol, Andheri East, Mumbai, Maharashtra 400059",B09B29F66W,safari flash medium 26l water resistant polyester casual standard backpack black
https://www.amazon.in/Hilfiger-Joshua-Backpack-TH-JOSHUALAP01/dp/B07N8GRWTZ/ref=sr_1_19?crid=2M096C61O4MLT&dib=eyJ2IjoiMSJ9.2s_4bINTAemBCixN4hvgAOOEDzri6aAEYls2gCVSseprUgztvIXajFCCZqLsR_OM_WQWzkwOnJFWCVXOeNBPVIX_tR3SBowUSYwtMTYc83cTwpXIiRGS0pUida4GI0UmJfr6qe_iAtVptL9CJsiUIWgZLG8EPGZ99vPM3SRrgO7fCzRca1Ou0ehMhbH6uJeXtr9jDhVxZhl5hx0_1CRZsGqbq-N3Sl6KEsjZyaSjHAc.uEX8opygUHrq-kSt91A9UdNu7aO66gpv0mGqZB0PZKk&dib_tag=se&keywords=bags&qid=1727240854&sprefix=ba%2Caps%2C283&sr=8-19,Tommy Hilfiger Joshua 21 Ltrs Black Laptop Backpack (TH/JOSHUALAP01),"₹1,375",4.3 out of 5 stars,"1,532","Iff Overseas Pvt Ltd, Brand Cocnetps Ltd 140/2 Ring Road Musakhedi Square Indore MP 452001",B07N8GRWTZ,tommy hilfiger joshua 21 ltrs black laptop backpack th joshualap01
https://www.amazon.in/Aristocrat-Nova-Laptop-Backpack-School/dp/B0D8BG7S4P/ref=sr_1_20?crid=2M096C61O4MLT&dib=eyJ2IjoiMSJ9.2s_4bINTAemBCixN4hvgAOOEDzri6aAEYls2gCVSseprUgztvIXajFCCZqLsR_OM_WQWzkwOnJFWCVXOeNBPVIX_tR3SBowUSYwtMTYc83cTwpXIiRGS0pUida4GI0UmJfr6qe_iAtVptL9CJsiUIWgZLG8EPGZ99vPM3SRrgO7fCzRca1Ou0ehMhbH6uJeXtr9jDhVxZhl5hx0_1CRZsGqbq-N3Sl6KEsjZyaSjHAc.uEX8opygUHrq-kSt91A9UdNu7aO66gpv0mGqZB0PZKk&dib_tag=se&keywords=bags&qid=1727240854&sprefix=ba%2Caps%2C283&sr=8-20,Aristocrat Nova Laptop Backpack - Black/School bag,₹335,3.6 out of 5 stars,30,"VIP Industries Limited, DGP House, 88C, Old Prabhadevi Road, Prabhadevi, Mumbai 400025. India, VIP Industries Limited, DGP House, 88C, Old Prabhadevi Road, Prabhadevi, Mumbai 400025. India",B0D8BG7S4P,aristocrat nova laptop backpack black school bag
https://www.amazon.in/Wesley-Overnighter-Expandable-Compartment-Weekender/dp/B0CWYWGF3C/ref=sr_1_21?crid=2M096C61O4MLT&dib=eyJ2IjoiMSJ9.2s_4bINTAemBCixN4hvgAOOEDzri6aAEYls2gCVSseprUgztvIXajFCCZqLsR_OM_WQWzkwOnJFWCVXOeNBPVIX_tR3SBowUSYwtMTYc83cTwpXIiRGS0pUida4GI0UmJfr6qe_iAtVptL9CJsiUIWgZLG8EPGZ99vPM3SRrgO7fCzRca1Ou0ehMhbH6uJeXtr9jDhVxZhl5hx0_1CRZsGqbq-N3Sl6KEsjZyaSjHAc.uEX8opygUHrq-kSt91A9UdNu7aO66gpv0mGqZB0PZKk&dib_tag=se&keywords=bags&qid=1727240854&sprefix=ba%2Caps%2C283&sr=8-21,"Wesley Luxur 45 Ltrs Overnighter Expandable Travel Laptop Backpack, Flight Cabin Approved Carry On with 16 inch Laptop Compartment, Anti Theft feature business/Travel/Weekender/college, Charcoal Black",₹599,3.8 out of 5 stars,374,"Wesley, Longani Trading Company",B0CWYWGF3C,wesley luxur 45 ltrs overnighter expandable travel laptop backpack flight cabin approved carry 16 inch laptop compartment anti theft feature business travel weekender college charcoal black
https://www.amazon.in/Lavie-Sport-Sprinter-Daypack-Compartment/dp/B0CZNTPV92/ref=sr_1_22?crid=2M096C61O4MLT&dib=eyJ2IjoiMSJ9.2s_4bINTAemBCixN4hvgAOOEDzri6aAEYls2gCVSseprUgztvIXajFCCZqLsR_OM_WQWzkwOnJFWCVXOeNBPVIX_tR3SBowUSYwtMTYc83cTwpXIiRGS0pUida4GI0UmJfr6qe_iAtVptL9CJsiUIWgZLG8EPGZ99vPM3SRrgO7fCzRca1Ou0ehMhbH6uJeXtr9jDhVxZhl5hx0_1CRZsGqbq-N3Sl6KEsjZyaSjHAc.uEX8opygUHrq-kSt91A9UdNu7aO66gpv0mGqZB0PZKk&dib_tag=se&keywords=bags&qid=1727240854&sprefix=ba%2Caps%2C283&sr=8-22,Lavie Sport Sprinter 11 Litre Daypack Unisex Casual Bag For Boys & Girls,₹199,3.7 out of 5 stars,465,"Bagzone Lifestyle Pvt Ltd, Bagzone Lifestyle Pvt Ltd | | LAVIE 402, Ackruti Star, MIDC Central Road, Andheri East, Mumbai – 400093",B0CZNTPV92,lavie sport sprinter 11 litre daypack unisex casual bag boy girl
https://www.amazon.in/Storite-Pack-Big-Underbed-Moisture/dp/B07B8K3RQK/ref=sr_1_23?crid=2M096C61O4MLT&dib=eyJ2IjoiMSJ9.2s_4bINTAemBCixN4hvgAOOEDzri6aAEYls2gCVSseprUgztvIXajFCCZqLsR_OM_WQWzkwOnJFWCVXOeNBPVIX_tR3SBowUSYwtMTYc83cTwpXIiRGS0pUida4GI0UmJfr6qe_iAtVptL9CJsiUIWgZLG8EPGZ99vPM3SRrgO7fCzRca1Ou0ehMhbH6uJeXtr9jDhVxZhl5hx0_1CRZsGqbq-N3Sl6KEsjZyaSjHAc.uEX8opygUHrq-kSt91A9UdNu7aO66gpv0mGqZB0PZKk&dib_tag=se&keywords=bags&qid=1727240854&sprefix=ba%2Caps%2C283&sr=8-23,"Storite 2 Pack Moisture Proof Nylon Large Size Underbed Storage Bag For Clothes (54 x 46 x 28 cm) - Black, Rectangular",₹499,4.4 out of 5 stars,"20,953",SaiTech IT Pvt Ltd.,B07B8K3RQK,storite 2 pack moisture proof nylon large size underbed storage bag clothes 54 x 46 x 28 cm black rectangular
https://www.amazon.in/Amazon-Brand-Presto-Oxo-Biodegradable-Garbage/dp/B0821PN8L4/ref=sr_1_24?crid=2M096C61O4MLT&dib=eyJ2IjoiMSJ9.2s_4bINTAemBCixN4hvgAOOEDzri6aAEYls2gCVSseprUgztvIXajFCCZqLsR_OM_WQWzkwOnJFWCVXOeNBPVIX_tR3SBowUSYwtMTYc83cTwpXIiRGS0pUida4GI0UmJfr6qe_iAtVptL9CJsiUIWgZLG8EPGZ99vPM3SRrgO7fCzRca1Ou0ehMhbH6uJeXtr9jDhVxZhl5hx0_1CRZsGqbq-N3Sl6KEsjZyaSjHAc.uEX8opygUHrq-kSt91A9UdNu7aO66gpv0mGqZB0PZKk&dib_tag=se&keywords=bags&qid=1727240854&sprefix=ba%2Caps%2C283&sr=8-24,"Amazon Brand - Presto! Garbage Bags Medium 180 Count|19 x 21 inches Black , For Dry & Wet waste|30 bags/roll (Pack of 6)",₹359,4.4 out of 5 stars,"47,342","Narendar Plastics Pvt.Ltd, Narendar Plastics Pvt.Ltd , Survey no.436/1&2, Village Dabhel,Daman-396210(U.T.) Ph no :+91-22-26852500",B0821PN8L4,amazon brand presto garbage bag medium 180 count 19 x 21 inch black dry wet waste 30 bag roll pack 6
https://www.amazon.in/ROZEN-School-partition-Collage-Backpack/dp/B0CLKP7W9D/ref=sr_1_25?crid=2M096C61O4MLT&dib=eyJ2IjoiMSJ9.2s_4bINTAemBCixN4hvgAOOEDzri6aAEYls2gCVSseprUgztvIXajFCCZqLsR_OM_WQWzkwOnJFWCVXOeNBPVIX_tR3SBowUSYwtMTYc83cTwpXIiRGS0pUida4GI0UmJfr6qe_iAtVptL9CJsiUIWgZLG8EPGZ99vPM3SRrgO7fCzRca1Ou0ehMhbH6uJeXtr9jDhVxZhl5hx0_1CRZsGqbq-N3Sl6KEsjZyaSjHAc.uEX8opygUHrq-kSt91A9UdNu7aO66gpv0mGqZB0PZKk&dib_tag=se&keywords=bags&qid=1727240854&sprefix=ba%2Caps%2C283&sr=8-25,ROZEN School Bag For girls school bags for boys Class 5-10 Large 5 partition 45 L Laptop Collage Office Travel Unisex Backpack,₹675,4.4 out of 5 stars,117,"12-2-36/a/106 zb hyd telangana, 12-2-36/a/106 zb hyd telangana",B0CLKP7W9D,rozen school bag girl school bag boy class 5 10 large 5 partition 45 l laptop collage office travel unisex backpack
https://www.amazon.in/ADISA-BP004-Weight-Casual-Backpack/dp/B07G3CG9FC/ref=sr_1_26?crid=2M096C61O4MLT&dib=eyJ2IjoiMSJ9.2s_4bINTAemBCixN4hvgAOOEDzri6aAEYls2gCVSseprUgztvIXajFCCZqLsR_OM_WQWzkwOnJFWCVXOeNBPVIX_tR3SBowUSYwtMTYc83cTwpXIiRGS0pUida4GI0UmJfr6qe_iAtVptL9CJsiUIWgZLG8EPGZ99vPM3SRrgO7fCzRca1Ou0ehMhbH6uJeXtr9jDhVxZhl5hx0_1CRZsGqbq-N3Sl6KEsjZyaSjHAc.uEX8opygUHrq-kSt91A9UdNu7aO66gpv0mGqZB0PZKk&dib_tag=se&keywords=bags&qid=1727240854&sprefix=ba%2Caps%2C283&sr=8-26,ADISA Laptop Backpack 31 Ltrs,₹399,4.0 out of 5 stars,"6,513","ADISA, ADISA INTERNATIONAL, 42/34, Upper Ground Floor, DLF Industrial Area, Kirti Nagar, New Delhi 110015, careadisa@gmail.com",B07G3CG9FC,adisa laptop backpack 31 ltrs
https://www.amazon.in/Safari-Pentagon-Polypropylene-55-Hardsided/dp/B097QP6L5K/ref=sr_1_27?crid=2M096C61O4MLT&dib=eyJ2IjoiMSJ9.2s_4bINTAemBCixN4hvgAOOEDzri6aAEYls2gCVSseprUgztvIXajFCCZqLsR_OM_WQWzkwOnJFWCVXOeNBPVIX_tR3SBowUSYwtMTYc83cTwpXIiRGS0pUida4GI0UmJfr6qe_iAtVptL9CJsiUIWgZLG8EPGZ99vPM3SRrgO7fCzRca1Ou0ehMhbH6uJeXtr9jDhVxZhl5hx0_1CRZsGqbq-N3Sl6KEsjZyaSjHAc.uEX8opygUHrq-kSt91A9UdNu7aO66gpv0mGqZB0PZKk&dib_tag=se&keywords=bags&qid=1727240854&sprefix=ba%2Caps%2C283&sr=8-27,"Safari Pentagon 55 Cms Small Cabin Polypropylene Hard Sided 4 Wheels 360 Degree Wheeling System Luggage/Speed_Wheel Suitcase/Trolley Bag, Cyan Blue","₹1,799",4.2 out of 5 stars,"21,474","Safari, Safari Industries (India) Ltd, Safari Industries Ltd 301/302, A-Wing, The Qube, M.V.Road, Marol, Andheri(East), Near international Airport Mumbai- 400059 +91-22-40381851/838",B097QP6L5K,safari pentagon 55 cm small cabin polypropylene hard sided 4 wheel 360 degree wheeling system luggage speed_wheel suitcase trolley bag cyan blue
https://www.amazon.in/American-Tourister-BACKPACK-COMPARTMENT-ORGANIZER/dp/B0BTD4S4XF/ref=sr_1_28?crid=2M096C61O4MLT&dib=eyJ2IjoiMSJ9.2s_4bINTAemBCixN4hvgAOOEDzri6aAEYls2gCVSseprUgztvIXajFCCZqLsR_OM_WQWzkwOnJFWCVXOeNBPVIX_tR3SBowUSYwtMTYc83cTwpXIiRGS0pUida4GI0UmJfr6qe_iAtVptL9CJsiUIWgZLG8EPGZ99vPM3SRrgO7fCzRca1Ou0ehMhbH6uJeXtr9jDhVxZhl5hx0_1CRZsGqbq-N3Sl6KEsjZyaSjHAc.uEX8opygUHrq-kSt91A9UdNu7aO66gpv0mGqZB0PZKk&dib_tag=se&keywords=bags&qid=1727240854&sprefix=ba%2Caps%2C283&sr=8-28,American Tourister Valex 28 Ltrs Large Laptop Backpack,"₹1,399",4.3 out of 5 stars,"5,948","EXPERTS, China",B0BTD4S4XF,american tourister valex 28 ltrs large laptop backpack
https://www.amazon.in/Half-Moon-Laptop-Bag-Compartment/dp/B0C1NZLF67/ref=sr_1_29?crid=2M096C61O4MLT&dib=eyJ2IjoiMSJ9.2s_4bINTAemBCixN4hvgAOOEDzri6aAEYls2gCVSseprUgztvIXajFCCZqLsR_OM_WQWzkwOnJFWCVXOeNBPVIX_tR3SBowUSYwtMTYc83cTwpXIiRGS0pUida4GI0UmJfr6qe_iAtVptL9CJsiUIWgZLG8EPGZ99vPM3SRrgO7fCzRca1Ou0ehMhbH6uJeXtr9jDhVxZhl5hx0_1CRZsGqbq-N3Sl6KEsjZyaSjHAc.uEX8opygUHrq-kSt91A9UdNu7aO66gpv0mGqZB0PZKk&dib_tag=se&keywords=bags&qid=1727240854&sprefix=ba%2Caps%2C283&sr=8-29,Half Moon Valex Unisex School Bag/ 15.6 inch Laptop Backpack/College Bagpack/Office Back Packed | Laptop Bag for Men Women | School Bags for Boys & Girls with Small Pockets & Laptop Compartment,₹739,3.9 out of 5 stars,781,Half_Moon,B0C1NZLF67,half moon valex unisex school bag 15 6 inch laptop backpack college bagpack office back packed laptop bag men woman school bag boy girl small pocket laptop compartment
https://www.amazon.in/Fargo-Leatherette-White-Womens-Ladies/dp/B0D814GNXK/ref=sr_1_30?crid=2M096C61O4MLT&dib=eyJ2IjoiMSJ9.2s_4bINTAemBCixN4hvgAOOEDzri6aAEYls2gCVSseprUgztvIXajFCCZqLsR_OM_WQWzkwOnJFWCVXOeNBPVIX_tR3SBowUSYwtMTYc83cTwpXIiRGS0pUida4GI0UmJfr6qe_iAtVptL9CJsiUIWgZLG8EPGZ99vPM3SRrgO7fCzRca1Ou0ehMhbH6uJeXtr9jDhVxZhl5hx0_1CRZsGqbq-N3Sl6KEsjZyaSjHAc.uEX8opygUHrq-kSt91A9UdNu7aO66gpv0mGqZB0PZKk&dib_tag=se&keywords=bags&qid=1727240854&sprefix=ba%2Caps%2C283&sr=8-30,Fargo Leatherette Side White Sling Bags For Women's Ladies,₹129,3.1 out of 5 stars,464,Retail Grapple,B0D814GNXK,fargo leatherette side white sling bag woman lady
https://www.amazon.in/Skybags-BIZ-LAPTOP-BACKPACK-BLACK/dp/B0CJ3YMWLW/ref=sr_1_31?crid=2M096C61O4MLT&dib=eyJ2IjoiMSJ9.2s_4bINTAemBCixN4hvgAOOEDzri6aAEYls2gCVSseprUgztvIXajFCCZqLsR_OM_WQWzkwOnJFWCVXOeNBPVIX_tR3SBowUSYwtMTYc83cTwpXIiRGS0pUida4GI0UmJfr6qe_iAtVptL9CJsiUIWgZLG8EPGZ99vPM3SRrgO7fCzRca1Ou0ehMhbH6uJeXtr9jDhVxZhl5hx0_1CRZsGqbq-N3Sl6KEsjZyaSjHAc.uEX8opygUHrq-kSt91A9UdNu7aO66gpv0mGqZB0PZKk&dib_tag=se&keywords=bags&qid=1727240854&sprefix=ba%2Caps%2C283&sr=8-31,Skybags BIZ LAPTOP BACKPACK (E) BLACK,₹797,3.6 out of 5 stars,147,"VIP Industries Limited, DGP House, 88C, Old Prabhadevi Road, Prabhadevi, Mumbai 400025. India, VIP Industries Limited, DGP House, 88C, Old Prabhadevi Road, Prabhadevi, Mumbai 400025. India",B0CJ3YMWLW,skybags biz laptop backpack e black
