Product URL,Product Name,Product Price,Rating,Number of reviews,Manufacturer,ASIN,processed_text
https://www.amazon.in/Arctic-Fox-Backpack-Charging-Laptop/dp/B089QB6D7B/ref=sr_1_62?crid=2M096C61O4MLT&dib=eyJ2IjoiMSJ9.BIsR4La3zY9H1xb8DbhLM6HM5pZjlt2VOIPvcopPaTmUjrA12LrR_zOADbk8O6DWMpYzR4iRv1G9UdbXXDmaatKbJcdD6Zm1uOmFAiWMjjQ9stiM4hge7YKu3azzOTjRpmSg7qlfNTtEAxEEKmq0kRPiJ_bzzZF-3-UyF6_JssN_Y1OjFqSYiVvEvM6Cyp4jeW5-ua_YJIR2BoVr2YPSnly30zziXJT1Q7q3orCbNqM.IIsH15e3vlMyMKbyuWgKuQm5d1k5L-GxBPNSIeiwBwg&dib_tag=se&keywords=bags&qid=1727241003&sprefix=ba%2Caps%2C283&sr=8-62,Arctic Fox Slope Anti Theft 23 L Backpack with USB Charging Port 15 Inch Laptop Backpack (Marble Black),"₹1,366",4.5 out of 5 stars,"5,686","Arctic Fox, Outshiny India Pvt. Ltd., No.17, Ganesh Nagar, 8th B Cross,Narayanappa Layout, Kodigehalli,Bengaluru - 560097.",B089QB6D7B,arctic fox slope anti theft 23 l backpack usb charging port 15 inch laptop backpack marble black
https://www.amazon.in/FLYNGO-Insulated-School-Tiffine-Storage/dp/B0DBQ48VJB/ref=sr_1_63?crid=2M096C61O4MLT&dib=eyJ2IjoiMSJ9.BIsR4La3zY9H1xb8DbhLM6HM5pZjlt2VOIPvcopPaTmUjrA12LrR_zOADbk8O6DWMpYzR4iRv1G9UdbXXDmaatKbJcdD6Zm1uOmFAiWMjjQ9stiM4hge7YKu3azzOTjRpmSg7qlfNTtEAxEEKmq0kRPiJ_bzzZF-3-UyF6_JssN_Y1OjFqSYiVvEvM6Cyp4jeW5-ua_YJIR2BoVr2YPSnly30zziXJT1Q7q3orCbNqM.IIsH15e3vlMyMKbyuWgKuQm5d1k5L-GxBPNSIeiwBwg&dib_tag=se&keywords=bags&qid=1727241003&sprefix=ba%2Caps%2C283&sr=8-63,"FLYNGO Insulated Lunch Bag for Kids School, Men, Women Office, Travel Tiffine Pouch for Lunch Box, Hot & Cold Insulated Storage Bag (Blue Leaf) (Blue)",₹251,4.2 out of 5 stars,45,"FLYNGO INDIA, FLYNGO INDIA, SURAT 395005 - Flyngo.store@gmail.com, 08758612083",‎B0DBQ48VJB,flyngo insulated lunch bag kid school men woman office travel tiffine pouch lunch box hot cold insulated storage bag blue leaf blue
https://www.amazon.in/American-Tourister-AMT-SCH-02/dp/B07CJCGBVC/ref=sr_1_64?crid=2M096C61O4MLT&dib=eyJ2IjoiMSJ9.BIsR4La3zY9H1xb8DbhLM6HM5pZjlt2VOIPvcopPaTmUjrA12LrR_zOADbk8O6DWMpYzR4iRv1G9UdbXXDmaatKbJcdD6Zm1uOmFAiWMjjQ9stiM4hge7YKu3azzOTjRpmSg7qlfNTtEAxEEKmq0kRPiJ_bzzZF-3-UyF6_JssN_Y1OjFqSYiVvEvM6Cyp4jeW5-ua_YJIR2BoVr2YPSnly30zziXJT1Q7q3orCbNqM.IIsH15e3vlMyMKbyuWgKuQm5d1k5L-GxBPNSIeiwBwg&dib_tag=se&keywords=bags&qid=1727241003&sprefix=ba%2Caps%2C283&sr=8-64,American Tourister Backpack for travel with Organizer,"₹1,299",4.1 out of 5 stars,"9,660","Samsonite, American Tourister",B07CJCGBVC,american tourister backpack travel organizer
https://www.amazon.in/Skybags-ARCHIES-COLLEGE-BACKPACK-Polyester/dp/B0CMJ7MNGW/ref=sr_1_65?crid=2M096C61O4MLT&dib=eyJ2IjoiMSJ9.UlBar9XfGbe_WFQaGBmKThOqSVcrMEC32ru4G09tNZjEUidhfuKGnQeaJJ7XoXT41_OGxNPTYBha2mYPRWSY3TiS0Ab6LVwxm39SK6NaI0vO3OOxC5O_tebR0kXmikYBcESOnQw9pfonT5jDdP0RP8Q0XNt8pHPoHXDYvlldAaz6FpQoo4xovAsVILqLCeSmnGAkvi-WZV6jOHYfMLTmac2Xm93TKWbEvFoid6TllI8._pVndM0-bLAKDM7GTaf-4dVNelmzyG12FjAf6fvm168&dib_tag=se&keywords=bags&qid=1727241073&sprefix=ba%2Caps%2C283&sr=8-65,Skybags 22 Litres Archies College Backpack 02 (E) Black Polyester Onesize,"₹1,649",3.9 out of 5 stars,57,VIP Industries Limited,B0CMJ7MNGW,skybags 22 litre archies college backpack 02 e black polyester onesize
https://www.amazon.in/Orange-Black-Casual-Backpack-BKPECOBP40601/dp/B019HA8AIW/ref=sr_1_66?crid=2M096C61O4MLT&dib=eyJ2IjoiMSJ9.UlBar9XfGbe_WFQaGBmKThOqSVcrMEC32ru4G09tNZjEUidhfuKGnQeaJJ7XoXT41_OGxNPTYBha2mYPRWSY3TiS0Ab6LVwxm39SK6NaI0vO3OOxC5O_tebR0kXmikYBcESOnQw9pfonT5jDdP0RP8Q0XNt8pHPoHXDYvlldAaz6FpQoo4xovAsVILqLCeSmnGAkvi-WZV6jOHYfMLTmac2Xm93TKWbEvFoid6TllI8._pVndM0-bLAKDM7GTaf-4dVNelmzyG12FjAf6fvm168&dib_tag=se&keywords=bags&qid=1727241073&sprefix=ba%2Caps%2C283&sr=8-66,Gear Eco4 19L Small Water Resistant School Bag/Casual Backpack/Travel Daypack/Kids Bag/College Bag for Boys/Girls/Men/Women (Orange-Black),₹339,4.0 out of 5 stars,"5,349","Gear Merchandise PVT LTD, Gear Merchandise PVT LTD E/12 West Chowbaga Gulshan colony KoLkata-700100 Contact 9830403366",B019HA8AIW,gear eco4 19l small water resistant school bag casual backpack travel daypack kid bag college bag boy girl men woman orange black
https://www.amazon.in/LEGAL-BRIBE-Textured-Tote-Beige/dp/B0CP84GDFW/ref=sr_1_67?crid=2M096C61O4MLT&dib=eyJ2IjoiMSJ9.UlBar9XfGbe_WFQaGBmKThOqSVcrMEC32ru4G09tNZjEUidhfuKGnQeaJJ7XoXT41_OGxNPTYBha2mYPRWSY3TiS0Ab6LVwxm39SK6NaI0vO3OOxC5O_tebR0kXmikYBcESOnQw9pfonT5jDdP0RP8Q0XNt8pHPoHXDYvlldAaz6FpQoo4xovAsVILqLCeSmnGAkvi-WZV6jOHYfMLTmac2Xm93TKWbEvFoid6TllI8._pVndM0-bLAKDM7GTaf-4dVNelmzyG12FjAf6fvm168&dib_tag=se&keywords=bags&qid=1727241073&sprefix=ba%2Caps%2C283&sr=8-67,LEGAL BRIBE Textured Tote bag,₹559,3.7 out of 5 stars,292,"Legal Bribe, 2491, Teliwara, Sadar Bazar, Delhi, Legal Bribe, 2491, Teliwara, Sadar Bazar, Delhi, Legal Bribe, 8577, 2nd Floor, New Rohtak Road, Karol Bagh, New Delhi 110005; 9953982246",B0CP84GDFW,legal bribe textured tote bag
https://www.amazon.in/Newtone-Premium-Oxo-Plastic-Biodegradable/dp/B0CBPBQHNY/ref=sr_1_68?crid=2M096C61O4MLT&dib=eyJ2IjoiMSJ9.UlBar9XfGbe_WFQaGBmKThOqSVcrMEC32ru4G09tNZjEUidhfuKGnQeaJJ7XoXT41_OGxNPTYBha2mYPRWSY3TiS0Ab6LVwxm39SK6NaI0vO3OOxC5O_tebR0kXmikYBcESOnQw9pfonT5jDdP0RP8Q0XNt8pHPoHXDYvlldAaz6FpQoo4xovAsVILqLCeSmnGAkvi-WZV6jOHYfMLTmac2Xm93TKWbEvFoid6TllI8._pVndM0-bLAKDM7GTaf-4dVNelmzyG12FjAf6fvm168&dib_tag=se&keywords=bags&qid=1727241073&sprefix=ba%2Caps%2C283&sr=8-68,Newtone Premium Garbage Bags (Small) Size 17 X 19 Inches 3 Rolls (90 Bags) (Dustbin Bag/Trash Bag) (Black Colour) - (Pouch Packing),₹121,4.3 out of 5 stars,356,"Shalimar Plastic Industries, Supertex Woven Industries, Daman",B0CBPBQHNY,newtone premium garbage bag small size 17 x 19 inch 3 roll 90 bag dustbin bag trash bag black colour pouch packing
https://www.amazon.in/Storite-Travel-Duffle-Bag-Compartment/dp/B0D86P2BRQ/ref=sr_1_69?crid=2M096C61O4MLT&dib=eyJ2IjoiMSJ9.UlBar9XfGbe_WFQaGBmKThOqSVcrMEC32ru4G09tNZjEUidhfuKGnQeaJJ7XoXT41_OGxNPTYBha2mYPRWSY3TiS0Ab6LVwxm39SK6NaI0vO3OOxC5O_tebR0kXmikYBcESOnQw9pfonT5jDdP0RP8Q0XNt8pHPoHXDYvlldAaz6FpQoo4xovAsVILqLCeSmnGAkvi-WZV6jOHYfMLTmac2Xm93TKWbEvFoid6TllI8._pVndM0-bLAKDM7GTaf-4dVNelmzyG12FjAf6fvm168&dib_tag=se&keywords=bags&qid=1727241073&sprefix=ba%2Caps%2C283&sr=8-69,Storite Nylon 50 cms Imported Travel Duffle Bag Multi- Pocket Sports Shoulder Bag for Women with Wet Pocket & Shoe Compartment Weekender Overnight Travel Luggage Bag (Green - 50 x 18 x 29 cm),₹998,4.8 out of 5 stars,7,SaiTech IT,B0D86P2BRQ,storite nylon 50 cm imported travel duffle bag multi pocket sport shoulder bag woman wet pocket shoe compartment weekender overnight travel luggage bag green 50 x 18 x 29 cm
https://www.amazon.in/Lavie-Sport-Chairman-Compatible-compartments/dp/B0B45VLPMT/ref=sr_1_70?crid=2M096C61O4MLT&dib=eyJ2IjoiMSJ9.UlBar9XfGbe_WFQaGBmKThOqSVcrMEC32ru4G09tNZjEUidhfuKGnQeaJJ7XoXT41_OGxNPTYBha2mYPRWSY3TiS0Ab6LVwxm39SK6NaI0vO3OOxC5O_tebR0kXmikYBcESOnQw9pfonT5jDdP0RP8Q0XNt8pHPoHXDYvlldAaz6FpQoo4xovAsVILqLCeSmnGAkvi-WZV6jOHYfMLTmac2Xm93TKWbEvFoid6TllI8._pVndM0-bLAKDM7GTaf-4dVNelmzyG12FjAf6fvm168&dib_tag=se&keywords=bags&qid=1727241073&sprefix=ba%2Caps%2C283&sr=8-70,Lavie Sport 43cm Chairman 24 Litres Backpack with Padded Laptop Sleeve | Vegan Leather Business Backpack for Men & Women | Durable Office Bag | Upto 14 inch Notebook/MacBook Compatible,₹829,4.0 out of 5 stars,"3,076","Bagzone Lifestyle Pvt Ltd, Bagzone Lifestyle Pvt Ltd | | LAVIE 402, Ackruti Star, MIDC Central Road, Andheri East, Mumbai – 400093",B0B45VLPMT,lavie sport 43cm chairman 24 litre backpack padded laptop sleeve vegan leather business backpack men woman durable office bag upto 14 inch notebook macbook compatible
https://www.amazon.in/Skybags-LAPTOP-BACKPACK-BLACK-NAVY/dp/B0CJ3K6CGP/ref=sr_1_71?crid=2M096C61O4MLT&dib=eyJ2IjoiMSJ9.UlBar9XfGbe_WFQaGBmKThOqSVcrMEC32ru4G09tNZjEUidhfuKGnQeaJJ7XoXT41_OGxNPTYBha2mYPRWSY3TiS0Ab6LVwxm39SK6NaI0vO3OOxC5O_tebR0kXmikYBcESOnQw9pfonT5jDdP0RP8Q0XNt8pHPoHXDYvlldAaz6FpQoo4xovAsVILqLCeSmnGAkvi-WZV6jOHYfMLTmac2Xm93TKWbEvFoid6TllI8._pVndM0-bLAKDM7GTaf-4dVNelmzyG12FjAf6fvm168&dib_tag=se&keywords=bags&qid=1727241073&sprefix=ba%2Caps%2C283&sr=8-71,Skybags EVO LAPTOP BACKPACK BLACK & NAVY,₹535,3.9 out of 5 stars,99,"VIP Industries Limited, DGP House, 88C, Old Prabhadevi Road, Prabhadevi, Mumbai 400025. India, VIP Industries Limited, DGP House, 88C, Old Prabhadevi Road, Prabhadevi, Mumbai 400025. India",B0CJ3K6CGP,skybags evo laptop backpack black navy
https://www.amazon.in/Shalimar-Premium-OXO-Biodegradable-Garbage/dp/B08DHT1Z6N/ref=sr_1_72?crid=2M096C61O4MLT&dib=eyJ2IjoiMSJ9.UlBar9XfGbe_WFQaGBmKThOqSVcrMEC32ru4G09tNZjEUidhfuKGnQeaJJ7XoXT41_OGxNPTYBha2mYPRWSY3TiS0Ab6LVwxm39SK6NaI0vO3OOxC5O_tebR0kXmikYBcESOnQw9pfonT5jDdP0RP8Q0XNt8pHPoHXDYvlldAaz6FpQoo4xovAsVILqLCeSmnGAkvi-WZV6jOHYfMLTmac2Xm93TKWbEvFoid6TllI8._pVndM0-bLAKDM7GTaf-4dVNelmzyG12FjAf6fvm168&dib_tag=se&keywords=bags&qid=1727241073&sprefix=ba%2Caps%2C283&sr=8-72,Shalimar Premium Garbage Bags (Lavender Fragrance) Size 19 X 21 Inches (Medium) 120 Bags (4 Rolls) Dustbin Bag/Trash Bag - Green Color,₹297,4.5 out of 5 stars,"10,380","Shalimar Plastic Industries, Daman, Supertex Woven Industries, Daman",B08DHT1Z6N,shalimar premium garbage bag lavender fragrance size 19 x 21 inch medium 120 bag 4 roll dustbin bag trash bag green color
https://www.amazon.in/Safari-HiTech-Water-Resistant-Backpack/dp/B09B27B1Q6/ref=sr_1_73?crid=2M096C61O4MLT&dib=eyJ2IjoiMSJ9.UlBar9XfGbe_WFQaGBmKThOqSVcrMEC32ru4G09tNZjEUidhfuKGnQeaJJ7XoXT41_OGxNPTYBha2mYPRWSY3TiS0Ab6LVwxm39SK6NaI0vO3OOxC5O_tebR0kXmikYBcESOnQw9pfonT5jDdP0RP8Q0XNt8pHPoHXDYvlldAaz6FpQoo4xovAsVILqLCeSmnGAkvi-WZV6jOHYfMLTmac2Xm93TKWbEvFoid6TllI8._pVndM0-bLAKDM7GTaf-4dVNelmzyG12FjAf6fvm168&dib_tag=se&keywords=bags&qid=1727241073&sprefix=ba%2Caps%2C283&sr=8-73,"Safari Casual backpack 3 compartments, front pocket, bottle holder, School bags for boys & girls, College bag for women and men, Ideal for school, college, office & travel",₹949.05,4.1 out of 5 stars,"2,075","Safari Industries, Safari Industries Ltd 301/302, A-Wing, The Qube, M.V.Road, Marol, Andheri(East), Near international Airport Mumbai- 400059 +91-22-40381851/838",B09B27B1Q6,safari casual backpack 3 compartment front pocket bottle holder school bag boy girl college bag woman men ideal school college office travel
https://www.amazon.in/Storite-Cross-Travel-Dark-Grey/dp/B07PFF4RYC/ref=sr_1_74?crid=2M096C61O4MLT&dib=eyJ2IjoiMSJ9.UlBar9XfGbe_WFQaGBmKThOqSVcrMEC32ru4G09tNZjEUidhfuKGnQeaJJ7XoXT41_OGxNPTYBha2mYPRWSY3TiS0Ab6LVwxm39SK6NaI0vO3OOxC5O_tebR0kXmikYBcESOnQw9pfonT5jDdP0RP8Q0XNt8pHPoHXDYvlldAaz6FpQoo4xovAsVILqLCeSmnGAkvi-WZV6jOHYfMLTmac2Xm93TKWbEvFoid6TllI8._pVndM0-bLAKDM7GTaf-4dVNelmzyG12FjAf6fvm168&dib_tag=se&keywords=bags&qid=1727241073&sprefix=ba%2Caps%2C283&sr=8-74,"Storite 10 Inch Stylish Padded Mini Sling Bag for Men and Women, Small Passport Travel Bag and Small Sling Bag With Water Bottle Pocket (25x16x7.5cm, Dark Grey)",₹299,4.1 out of 5 stars,"9,491","SaiTech IT Private Limited, Bhayli, Vadodara",B07PFF4RYC,storite 10 inch stylish padded mini sling bag men woman small passport travel bag small sling bag water bottle pocket 25x16x7 5cm dark grey
https://www.amazon.in/Shalimar-Premium-Garbage-Large-Rolls/dp/B07KT98RKS/ref=sr_1_75?crid=2M096C61O4MLT&dib=eyJ2IjoiMSJ9.UlBar9XfGbe_WFQaGBmKThOqSVcrMEC32ru4G09tNZjEUidhfuKGnQeaJJ7XoXT41_OGxNPTYBha2mYPRWSY3TiS0Ab6LVwxm39SK6NaI0vO3OOxC5O_tebR0kXmikYBcESOnQw9pfonT5jDdP0RP8Q0XNt8pHPoHXDYvlldAaz6FpQoo4xovAsVILqLCeSmnGAkvi-WZV6jOHYfMLTmac2Xm93TKWbEvFoid6TllI8._pVndM0-bLAKDM7GTaf-4dVNelmzyG12FjAf6fvm168&dib_tag=se&keywords=bags&qid=1727241073&sprefix=ba%2Caps%2C283&sr=8-75,Shalimar Premium Garbage Bags ( Lavender Fragrance ) Size 24 X 32 Inches (Large) 60 Bags (4 rolls) Dustbin Bag/Trash Bag - Black Color,₹303,4.5 out of 5 stars,"5,392","Shalimar Plastic Industries, Daman, Supertex Woven Industries, Daman",B07KT98RKS,shalimar premium garbage bag lavender fragrance size 24 x 32 inch large 60 bag 4 roll dustbin bag trash bag black color
https://www.amazon.in/Storite-Lightweight-Adjustable-Grey-21x10x17cm/dp/B0CG9JP686/ref=sr_1_76?crid=2M096C61O4MLT&dib=eyJ2IjoiMSJ9.UlBar9XfGbe_WFQaGBmKThOqSVcrMEC32ru4G09tNZjEUidhfuKGnQeaJJ7XoXT41_OGxNPTYBha2mYPRWSY3TiS0Ab6LVwxm39SK6NaI0vO3OOxC5O_tebR0kXmikYBcESOnQw9pfonT5jDdP0RP8Q0XNt8pHPoHXDYvlldAaz6FpQoo4xovAsVILqLCeSmnGAkvi-WZV6jOHYfMLTmac2Xm93TKWbEvFoid6TllI8._pVndM0-bLAKDM7GTaf-4dVNelmzyG12FjAf6fvm168&dib_tag=se&keywords=bags&qid=1727241073&sprefix=ba%2Caps%2C283&sr=8-76,"Storite Women's Stylish Small Lightweight Sling Crossbody Shoulder Bag, Portable Handbag Bag With Inner Padded Pocket & Adjustable Strap (21x10x17cm)",₹749,4.1 out of 5 stars,289,Not found,B0CG9JP686,storite woman stylish small lightweight sling crossbody shoulder bag portable handbag bag inner padded pocket adjustable strap 21x10x17cm
https://www.amazon.in/Lavie-womens-Monoprint-Raily-Large/dp/B0C8TKMD19/ref=sr_1_77?crid=2M096C61O4MLT&dib=eyJ2IjoiMSJ9.UlBar9XfGbe_WFQaGBmKThOqSVcrMEC32ru4G09tNZjEUidhfuKGnQeaJJ7XoXT41_OGxNPTYBha2mYPRWSY3TiS0Ab6LVwxm39SK6NaI0vO3OOxC5O_tebR0kXmikYBcESOnQw9pfonT5jDdP0RP8Q0XNt8pHPoHXDYvlldAaz6FpQoo4xovAsVILqLCeSmnGAkvi-WZV6jOHYfMLTmac2Xm93TKWbEvFoid6TllI8._pVndM0-bLAKDM7GTaf-4dVNelmzyG12FjAf6fvm168&dib_tag=se&keywords=bags&qid=1727241073&sprefix=ba%2Caps%2C283&sr=8-77,Lavie Women's Monoprint Raily Tote Bag | Ladies Purse Handbag,"₹1,499",3.8 out of 5 stars,116,"Bagzone Lifestyle Pvt Ltd, Bagzone Lifestyle Pvt Ltd | | LAVIE 402, Ackruti Star, MIDC Central Road, Andheri East, Mumbai – 400093",B0C8TKMD19,lavie woman monoprint raily tote bag lady purse handbag
https://www.amazon.in/F-Gear-String-Polyester-33-cms-Black-Drawstring-Gym-Bag/dp/B07PC28YQ9/ref=sr_1_78?crid=2M096C61O4MLT&dib=eyJ2IjoiMSJ9.UlBar9XfGbe_WFQaGBmKThOqSVcrMEC32ru4G09tNZjEUidhfuKGnQeaJJ7XoXT41_OGxNPTYBha2mYPRWSY3TiS0Ab6LVwxm39SK6NaI0vO3OOxC5O_tebR0kXmikYBcESOnQw9pfonT5jDdP0RP8Q0XNt8pHPoHXDYvlldAaz6FpQoo4xovAsVILqLCeSmnGAkvi-WZV6jOHYfMLTmac2Xm93TKWbEvFoid6TllI8._pVndM0-bLAKDM7GTaf-4dVNelmzyG12FjAf6fvm168&dib_tag=se&keywords=bags&qid=1727241073&sprefix=ba%2Caps%2C283&sr=8-78,F Gear String 11 Ltrs Gym Bag,₹159,4.1 out of 5 stars,"1,315","Uber Fashion Merchandise Pvt. Ltd., F Gear, Jindal Edifice, No 90/2, 3rd Main, 2nd Stage, Industrial Suburb, Yeshwantpur, Bengaluru, Karnataka 560022",B07PC28YQ9,f gear string 11 ltrs gym bag
https://www.amazon.in/Skybags-NEON-23-03-SCHOOL-TEAL/dp/B0CK1FJYQ8/ref=sr_1_79_mod_primary_new?crid=2M096C61O4MLT&dib=eyJ2IjoiMSJ9.UlBar9XfGbe_WFQaGBmKThOqSVcrMEC32ru4G09tNZjEUidhfuKGnQeaJJ7XoXT41_OGxNPTYBha2mYPRWSY3TiS0Ab6LVwxm39SK6NaI0vO3OOxC5O_tebR0kXmikYBcESOnQw9pfonT5jDdP0RP8Q0XNt8pHPoHXDYvlldAaz6FpQoo4xovAsVILqLCeSmnGAkvi-WZV6jOHYfMLTmac2Xm93TKWbEvFoid6TllI8._pVndM0-bLAKDM7GTaf-4dVNelmzyG12FjAf6fvm168&dib_tag=se&keywords=bags&qid=1727241073&sbo=RZvfv%2F%2FHxDF%2BO5021pAnSA%3D%3D&sprefix=ba%2Caps%2C283&sr=8-79,Skybags NEW NEON 23-03 SCHOOL BP (H) TEAL,"₹1,190",4.0 out of 5 stars,174,VIP Industries Limited,B0CK1FJYQ8,skybags new neon 23 03 school bp h teal
https://www.amazon.in/Wildcraft-Black-Casual-Backpack-11947/dp/B07N2LC749/ref=sr_1_80_mod_primary_new?crid=2M096C61O4MLT&dib=eyJ2IjoiMSJ9.UlBar9XfGbe_WFQaGBmKThOqSVcrMEC32ru4G09tNZjEUidhfuKGnQeaJJ7XoXT41_OGxNPTYBha2mYPRWSY3TiS0Ab6LVwxm39SK6NaI0vO3OOxC5O_tebR0kXmikYBcESOnQw9pfonT5jDdP0RP8Q0XNt8pHPoHXDYvlldAaz6FpQoo4xovAsVILqLCeSmnGAkvi-WZV6jOHYfMLTmac2Xm93TKWbEvFoid6TllI8._pVndM0-bLAKDM7GTaf-4dVNelmzyG12FjAf6fvm168&dib_tag=se&keywords=bags&qid=1727241073&sbo=RZvfv%2F%2FHxDF%2BO5021pAnSA%3D%3D&sprefix=ba%2Caps%2C283&sr=8-80,"Wildcraft 29.5 Ltrs Black Casual Standard Backpack (11947 Black) (Medium Size), 29.5 Litre",₹990,4.2 out of 5 stars,"1,255",Wildcraft,B07N2LC749,wildcraft 29 5 ltrs black casual standard backpack 11947 black medium size 29 5 litre
https://www.amazon.in/Girls-1522-Polyester-Designer-Waterproof-Bag-Backpack/dp/B08F9SFYXQ/ref=sr_1_81?crid=2M096C61O4MLT&dib=eyJ2IjoiMSJ9.UI7UzFmR6jL3DCyDWcD60Eu5TDz8FdpCgo__0Ob_XZxnHTBdTAaPjN41YYa6YdGJ5tB8y3vxQwc5wuYGtFOFnzl2aSEkbdPpzKwoFq9AypHIDmhZj9XnwS9Iu1V1UaDuKmebN973pYXimuSdlJuYN32tfjSEr-A_CFz8bUucOyS_KyX8tDJYjQPlitgPQEJcOZ4go6zZu2TxDEVBeE1Ys44dbMC7IM2GYh6UdDfTX7k.pfQU9auW-p7tUtJ4SL6RO6nUNhJcMOO3hX8l4PlN8QU&dib_tag=se&keywords=bags&qid=1727241139&sprefix=ba%2Caps%2C283&sr=8-81,BEAUTY GIRLS BY HOTSHOT 1522|School Bag|Tuition Bag|College Backpack|ForGirls&Women|Waterproof Bag,₹679,4.2 out of 5 stars,"2,553","Shri Salasar Enterprises, Customer care no : 18003099472 contact@hotshotbags.com",B08F9SFYXQ,beauty girl hotshot 1522 school bag tuition bag college backpack forgirls woman waterproof bag
https://www.amazon.in/Safari-Overnighter-Resistant-Travelling-All-Purpose/dp/B07BZ5VC4H/ref=sr_1_82?crid=2M096C61O4MLT&dib=eyJ2IjoiMSJ9.UI7UzFmR6jL3DCyDWcD60Eu5TDz8FdpCgo__0Ob_XZxnHTBdTAaPjN41YYa6YdGJ5tB8y3vxQwc5wuYGtFOFnzl2aSEkbdPpzKwoFq9AypHIDmhZj9XnwS9Iu1V1UaDuKmebN973pYXimuSdlJuYN32tfjSEr-A_CFz8bUucOyS_KyX8tDJYjQPlitgPQEJcOZ4go6zZu2TxDEVBeE1Ys44dbMC7IM2GYh6UdDfTX7k.pfQU9auW-p7tUtJ4SL6RO6nUNhJcMOO3hX8l4PlN8QU&dib_tag=se&keywords=bags&qid=1727241139&sprefix=ba%2Caps%2C283&sr=8-82,"Safari Seek 45L Expandable Overnighter Laptop Backpack with Suitcase Compartment, Compression Straps & Raincover, Travel Bag for Men and Women, Ideal for Outdoor Use, Office, College, Color – Black","₹2,299",4.4 out of 5 stars,"9,202","Safari, Safari Industries Ltd 301/302, A-Wing, The Qube, M.V.Road, Marol, Andheri(East), Near international Airport Mumbai- 400059 +91-22-40381851/838",B07BZ5VC4H,safari seek 45l expandable overnighter laptop backpack suitcase compartment compression strap raincover travel bag men woman ideal outdoor use office college color black
https://www.amazon.in/Shalimar-Premium-Garbage-Medium-Black/dp/B016DCB9OO/ref=sr_1_83?crid=2M096C61O4MLT&dib=eyJ2IjoiMSJ9.UI7UzFmR6jL3DCyDWcD60Eu5TDz8FdpCgo__0Ob_XZxnHTBdTAaPjN41YYa6YdGJ5tB8y3vxQwc5wuYGtFOFnzl2aSEkbdPpzKwoFq9AypHIDmhZj9XnwS9Iu1V1UaDuKmebN973pYXimuSdlJuYN32tfjSEr-A_CFz8bUucOyS_KyX8tDJYjQPlitgPQEJcOZ4go6zZu2TxDEVBeE1Ys44dbMC7IM2GYh6UdDfTX7k.pfQU9auW-p7tUtJ4SL6RO6nUNhJcMOO3hX8l4PlN8QU&dib_tag=se&keywords=bags&qid=1727241139&sprefix=ba%2Caps%2C283&sr=8-83,Shalimar Premium Garbage Bags ( Lavender Fragrance ) Size 19 X 21 Inches (Medium) 180 Bags (6 Rolls) Dustbin Bag/Trash Bag - Black Color,₹421,4.5 out of 5 stars,"10,302","Shalimar Plastic Industries, Daman, Supertex Woven Industries, Daman",B016DCB9OO,shalimar premium garbage bag lavender fragrance size 19 x 21 inch medium 180 bag 6 roll dustbin bag trash bag black color
https://www.amazon.in/Puma-Black-School-Backpack-7662201/dp/B07SMJD685/ref=sr_1_84?crid=2M096C61O4MLT&dib=eyJ2IjoiMSJ9.UI7UzFmR6jL3DCyDWcD60Eu5TDz8FdpCgo__0Ob_XZxnHTBdTAaPjN41YYa6YdGJ5tB8y3vxQwc5wuYGtFOFnzl2aSEkbdPpzKwoFq9AypHIDmhZj9XnwS9Iu1V1UaDuKmebN973pYXimuSdlJuYN32tfjSEr-A_CFz8bUucOyS_KyX8tDJYjQPlitgPQEJcOZ4go6zZu2TxDEVBeE1Ys44dbMC7IM2GYh6UdDfTX7k.pfQU9auW-p7tUtJ4SL6RO6nUNhJcMOO3hX8l4PlN8QU&dib_tag=se&keywords=bags&qid=1727241139&sprefix=ba%2Caps%2C283&sr=8-84,"Puma Unisex-Adult Phase Backpack II, Black, X (7662201)",₹839,3.9 out of 5 stars,473,"Puma, Dongguan City,Meihao Industrial Co Ltd,No. 1C, Sha Ping Road,,Tangxia Town, , 523711 Dongguan,Guangdong China",B07SMJD685,puma unisex adult phase backpack ii black x 7662201
https://www.amazon.in/Amazon-Brand-Presto-Oxo-Biodegradable-Garbage/dp/B0821PYKVK/ref=sr_1_85?crid=2M096C61O4MLT&dib=eyJ2IjoiMSJ9.UI7UzFmR6jL3DCyDWcD60Eu5TDz8FdpCgo__0Ob_XZxnHTBdTAaPjN41YYa6YdGJ5tB8y3vxQwc5wuYGtFOFnzl2aSEkbdPpzKwoFq9AypHIDmhZj9XnwS9Iu1V1UaDuKmebN973pYXimuSdlJuYN32tfjSEr-A_CFz8bUucOyS_KyX8tDJYjQPlitgPQEJcOZ4go6zZu2TxDEVBeE1Ys44dbMC7IM2GYh6UdDfTX7k.pfQU9auW-p7tUtJ4SL6RO6nUNhJcMOO3hX8l4PlN8QU&dib_tag=se&keywords=bags&qid=1727241139&sprefix=ba%2Caps%2C283&sr=8-85,"Amazon Brand - Presto! Garbage Bags Large 90 Count|24 x 32 Inches Black , For Dry & Wet waste|15 bags/roll (Pack of 6)",₹369,4.3 out of 5 stars,"13,640","Relogix Distraibution Pvt.Ltd , Industrial Plot No.26, G.I.D.C.,Vapi, Valsad, Gujarat – 396195, Narendar Plastics Pvt.Ltd , Survey no.436/1&2, Village Dabhel,Daman-396210(U.T.) Ph no :+91-22-26852500",B0821PYKVK,amazon brand presto garbage bag large 90 count 24 x 32 inch black dry wet waste 15 bag roll pack 6
https://www.amazon.in/Safari-Spartan-Water-Resistant-Backpack/dp/B09B277CR5/ref=sr_1_86?crid=2M096C61O4MLT&dib=eyJ2IjoiMSJ9.UI7UzFmR6jL3DCyDWcD60Eu5TDz8FdpCgo__0Ob_XZxnHTBdTAaPjN41YYa6YdGJ5tB8y3vxQwc5wuYGtFOFnzl2aSEkbdPpzKwoFq9AypHIDmhZj9XnwS9Iu1V1UaDuKmebN973pYXimuSdlJuYN32tfjSEr-A_CFz8bUucOyS_KyX8tDJYjQPlitgPQEJcOZ4go6zZu2TxDEVBeE1Ys44dbMC7IM2GYh6UdDfTX7k.pfQU9auW-p7tUtJ4SL6RO6nUNhJcMOO3hX8l4PlN8QU&dib_tag=se&keywords=bags&qid=1727241139&sprefix=ba%2Caps%2C283&sr=8-86,"Safari Spartan 21 Ltrs Water Resistant Backpack - Teal, S (SPARTAN19CBTEA)",₹499,3.8 out of 5 stars,"1,433","Safari Industries, 302-303, A Wing, The Qube CTS No.1498, A/2, Sir Mathuradas Vasanji Rd, Marol, Andheri East, Mumbai, Maharashtra 400059",B09B277CR5,safari spartan 21 ltrs water resistant backpack teal spartan19cbtea
https://www.amazon.in/Urban-Jungle-Resistant-Polyester-Flat-Open/dp/B0CYLVVZ2M/ref=sr_1_87?crid=2M096C61O4MLT&dib=eyJ2IjoiMSJ9.UI7UzFmR6jL3DCyDWcD60Eu5TDz8FdpCgo__0Ob_XZxnHTBdTAaPjN41YYa6YdGJ5tB8y3vxQwc5wuYGtFOFnzl2aSEkbdPpzKwoFq9AypHIDmhZj9XnwS9Iu1V1UaDuKmebN973pYXimuSdlJuYN32tfjSEr-A_CFz8bUucOyS_KyX8tDJYjQPlitgPQEJcOZ4go6zZu2TxDEVBeE1Ys44dbMC7IM2GYh6UdDfTX7k.pfQU9auW-p7tUtJ4SL6RO6nUNhJcMOO3hX8l4PlN8QU&dib_tag=se&keywords=bags&qid=1727241139&sprefix=ba%2Caps%2C283&sr=8-87,"Urban Jungle by Safari Venture Workpack 23 Liters Water Resistant, L-Open, Premium Polyester Laptop Backpack","₹4,495",4.5 out of 5 stars,30,"Urban Jungle, Safari Industries (India) Ltd, 302,303 A Wing, The Qube CTS No.1498, A/2 Sir Mathuradas Vasanji road, Marol, Andheri East, Mumbai, Maharashtra 400059",B0CYLVVZ2M,urban jungle safari venture workpack 23 liter water resistant l open premium polyester laptop backpack
https://www.amazon.in/ZOUK-Printed-Handmade-Leather-handles/dp/B07NHYLTY7/ref=sr_1_88?crid=2M096C61O4MLT&dib=eyJ2IjoiMSJ9.UI7UzFmR6jL3DCyDWcD60Eu5TDz8FdpCgo__0Ob_XZxnHTBdTAaPjN41YYa6YdGJ5tB8y3vxQwc5wuYGtFOFnzl2aSEkbdPpzKwoFq9AypHIDmhZj9XnwS9Iu1V1UaDuKmebN973pYXimuSdlJuYN32tfjSEr-A_CFz8bUucOyS_KyX8tDJYjQPlitgPQEJcOZ4go6zZu2TxDEVBeE1Ys44dbMC7IM2GYh6UdDfTX7k.pfQU9auW-p7tUtJ4SL6RO6nUNhJcMOO3hX8l4PlN8QU&dib_tag=se&keywords=bags&qid=1727241139&sprefix=ba%2Caps%2C283&sr=8-88,"ZOUK Vegan Leather Women's Office Bag for 15.6 inch Laptop, MacBook","₹1,499",4.3 out of 5 stars,"5,005","Seaturtle Pvt. Ltd. Thakur Compound, 2nd Floor, 3, USV Lane, Deonar, Mumbai, Maharashtra 400088, Sea Turtle Pvt Ltd, Near Kalher Village, Building No 1-6/H No 196/Gala No 1-5, 1st Floor, Shree Arihant Complex, Bhiwandi Road, Kopar, Bhiwandi, Thane, Maharashtra - 421302",B07NHYLTY7,zouk vegan leather woman office bag 15 6 inch laptop macbook
https://www.amazon.in/Perpetual-Garbage-Medium-Dustbin-Covers/dp/B0CV5KLM16/ref=sr_1_89?crid=2M096C61O4MLT&dib=eyJ2IjoiMSJ9.UI7UzFmR6jL3DCyDWcD60Eu5TDz8FdpCgo__0Ob_XZxnHTBdTAaPjN41YYa6YdGJ5tB8y3vxQwc5wuYGtFOFnzl2aSEkbdPpzKwoFq9AypHIDmhZj9XnwS9Iu1V1UaDuKmebN973pYXimuSdlJuYN32tfjSEr-A_CFz8bUucOyS_KyX8tDJYjQPlitgPQEJcOZ4go6zZu2TxDEVBeE1Ys44dbMC7IM2GYh6UdDfTX7k.pfQU9auW-p7tUtJ4SL6RO6nUNhJcMOO3hX8l4PlN8QU&dib_tag=se&keywords=bags&qid=1727241139&sprefix=ba%2Caps%2C283&sr=8-89,Perpetual Garbage Bags | Medium 90 Pcs (30 Pcs x Pack of 3 Rolls) | | Dustbin Covers for Wet & Dry Waste - (Black-19 x 21 Inch),₹143,3.3 out of 5 stars,307,"S S TRADEMART, TONK ROAD, JAIPUR- 9460389367, S S TRADEMART, TONK ROAD, JAIPUR- 9460389367",‎B0CV5KLM16,perpetual garbage bag medium 90 pc 30 pc x pack 3 roll dustbin cover wet dry waste black 19 x 21 inch
https://www.amazon.in/American-Tourister-AMT-SCH-02/dp/B07CJCGM1M/ref=sr_1_90?crid=2M096C61O4MLT&dib=eyJ2IjoiMSJ9.UI7UzFmR6jL3DCyDWcD60Eu5TDz8FdpCgo__0Ob_XZxnHTBdTAaPjN41YYa6YdGJ5tB8y3vxQwc5wuYGtFOFnzl2aSEkbdPpzKwoFq9AypHIDmhZj9XnwS9Iu1V1UaDuKmebN973pYXimuSdlJuYN32tfjSEr-A_CFz8bUucOyS_KyX8tDJYjQPlitgPQEJcOZ4go6zZu2TxDEVBeE1Ys44dbMC7IM2GYh6UdDfTX7k.pfQU9auW-p7tUtJ4SL6RO6nUNhJcMOO3hX8l4PlN8QU&dib_tag=se&keywords=bags&qid=1727241139&sprefix=ba%2Caps%2C283&sr=8-90,"American Tourister Fizz Backpack School bag for travel with Organizer Bottle compartment water resistant backpack for Men, Women, Boys Laptop Backpack for College Gift for Men & Women","₹1,299",4.0 out of 5 stars,"51,351","Samsonite, American Tourister",B07CJCGM1M,american tourister fizz backpack school bag travel organizer bottle compartment water resistant backpack men woman boy laptop backpack college gift men woman
https://www.amazon.in/SHALIMAR-Capacity-Travel-Storage-Duffel/dp/B0BZZ3Q811/ref=sr_1_91?crid=2M096C61O4MLT&dib=eyJ2IjoiMSJ9.UI7UzFmR6jL3DCyDWcD60Eu5TDz8FdpCgo__0Ob_XZxnHTBdTAaPjN41YYa6YdGJ5tB8y3vxQwc5wuYGtFOFnzl2aSEkbdPpzKwoFq9AypHIDmhZj9XnwS9Iu1V1UaDuKmebN973pYXimuSdlJuYN32tfjSEr-A_CFz8bUucOyS_KyX8tDJYjQPlitgPQEJcOZ4go6zZu2TxDEVBeE1Ys44dbMC7IM2GYh6UdDfTX7k.pfQU9auW-p7tUtJ4SL6RO6nUNhJcMOO3hX8l4PlN8QU&dib_tag=se&keywords=bags&qid=1727241139&sprefix=ba%2Caps%2C283&sr=8-91,"Shalimar Large Capacity Travel Bag/Storage Bag/Move-in Bags/Duffel Bag - Strong, Durable, Foldable and Water Resistant (Pack of - 2) - Black (62.23 L x 30.48 W x 35.56 H)",₹508,4.4 out of 5 stars,181,"Vikrant Extrusions, Daman, Vikrant Extrusions, Daman",B0BZZ3Q811,shalimar large capacity travel bag storage bag move bag duffel bag strong durable foldable water resistant pack 2 black 62 23 l x 30 48 w x 35 56 h
