Product URL,Product Name,Product Price,Rating,Number of reviews,Manufacturer,ASIN,processed_text
https://www.amazon.in/Skybags-NETWORK-LAPTOP-BACKPACK-BLACK/dp/B0B3XY3CCD/ref=sr_1_92?crid=2M096C61O4MLT&dib=eyJ2IjoiMSJ9.UI7UzFmR6jL3DCyDWcD60Eu5TDz8FdpCgo__0Ob_XZxnHTBdTAaPjN41YYa6YdGJ5tB8y3vxQwc5wuYGtFOFnzl2aSEkbdPpzKwoFq9AypHIDmhZj9XnwS9Iu1V1UaDuKmebN973pYXimuSdlJuYN32tfjSEr-A_CFz8bUucOyS_KyX8tDJYjQPlitgPQEJcOZ4go6zZu2TxDEVBeE1Ys44dbMC7IM2GYh6UdDfTX7k.pfQU9auW-p7tUtJ4SL6RO6nUNhJcMOO3hX8l4PlN8QU&dib_tag=se&keywords=bags&qid=1727241139&sprefix=ba%2Caps%2C283&sr=8-92,"Skybags Laptop Backpack 32L With Rain Cover, 3 Spacious Compartments, Front Access Pocket & Gadget Pocket | Black | Network NXT","₹1,272",3.9 out of 5 stars,166,"VIP Industries Limited, DGP House, 88C, Old Prabhadevi Road, Prabhadevi, Mumbai 400025. India, VIP Industries Limited, DGP House, 88C, Old Prabhadevi Road, Prabhadevi, Mumbai 400025. India",B0B3XY3CCD,skybags laptop backpack 32l rain cover 3 spacious compartment front access pocket gadget pocket black network nxt
https://www.amazon.in/Skybags-Cardiff-Polyester-Travel-DFCAR55BLU/dp/B073JYDK7P/ref=sr_1_93?crid=2M096C61O4MLT&dib=eyJ2IjoiMSJ9.UI7UzFmR6jL3DCyDWcD60Eu5TDz8FdpCgo__0Ob_XZxnHTBdTAaPjN41YYa6YdGJ5tB8y3vxQwc5wuYGtFOFnzl2aSEkbdPpzKwoFq9AypHIDmhZj9XnwS9Iu1V1UaDuKmebN973pYXimuSdlJuYN32tfjSEr-A_CFz8bUucOyS_KyX8tDJYjQPlitgPQEJcOZ4go6zZu2TxDEVBeE1Ys44dbMC7IM2GYh6UdDfTX7k.pfQU9auW-p7tUtJ4SL6RO6nUNhJcMOO3hX8l4PlN8QU&dib_tag=se&keywords=bags&qid=1727241139&sprefix=ba%2Caps%2C283&sr=8-93,Skybags Polyester Blue Softsided Luggage Set,₹849,4.2 out of 5 stars,"10,634","VIP Industries Ltd, VIP Industries Ltd, DGP House, 5 th Floor, 88C Old Prabhadevi Road, Mumbai, Maharashtra - 400025; 24X7 Toll Free Helpline No. 1800-1022-256",B073JYDK7P,skybags polyester blue softsided luggage set
https://www.amazon.in/Kuber-Industries-Organiser-Wardrobe-Transparent/dp/B084826MP5/ref=sr_1_94?crid=2M096C61O4MLT&dib=eyJ2IjoiMSJ9.UI7UzFmR6jL3DCyDWcD60Eu5TDz8FdpCgo__0Ob_XZxnHTBdTAaPjN41YYa6YdGJ5tB8y3vxQwc5wuYGtFOFnzl2aSEkbdPpzKwoFq9AypHIDmhZj9XnwS9Iu1V1UaDuKmebN973pYXimuSdlJuYN32tfjSEr-A_CFz8bUucOyS_KyX8tDJYjQPlitgPQEJcOZ4go6zZu2TxDEVBeE1Ys44dbMC7IM2GYh6UdDfTX7k.pfQU9auW-p7tUtJ4SL6RO6nUNhJcMOO3hX8l4PlN8QU&dib_tag=se&keywords=bags&qid=1727241139&sprefix=ba%2Caps%2C283&sr=8-94,Kuber Industries Polka Dots Design Non-woven Foldable Saree Cover|Clothes Storage Bag/Wardrobe Organizer|Zipper Closer With Transparent Window|Size 46 x 32 x 22 CM|Pack of 3 (Black & White),₹186,4.0 out of 5 stars,"2,646","Kuber Industries, KUBER MART INDUSTRIES PRIVATE LIMITED, KUBER MART INDUSTRIES PRIVATE LIMITED, JALAJ G1-184 & 185, EPIP, BANK OF BARODA,LANE, GARMENT ZONE, SITAPURA,JAIPUR,(RAJ) 302012, Mob:-8505030382",‎B084826MP5,kuber industry polka dot design non woven foldable saree cover clothes storage bag wardrobe organizer zipper closer transparent window size 46 x 32 x 22 cm pack 3 black white
https://www.amazon.in/Wildcraft-Polyester-liters-laptop-Backpack/dp/B09LRBBVSL/ref=sr_1_95?crid=2M096C61O4MLT&dib=eyJ2IjoiMSJ9.UI7UzFmR6jL3DCyDWcD60Eu5TDz8FdpCgo__0Ob_XZxnHTBdTAaPjN41YYa6YdGJ5tB8y3vxQwc5wuYGtFOFnzl2aSEkbdPpzKwoFq9AypHIDmhZj9XnwS9Iu1V1UaDuKmebN973pYXimuSdlJuYN32tfjSEr-A_CFz8bUucOyS_KyX8tDJYjQPlitgPQEJcOZ4go6zZu2TxDEVBeE1Ys44dbMC7IM2GYh6UdDfTX7k.pfQU9auW-p7tUtJ4SL6RO6nUNhJcMOO3hX8l4PlN8QU&dib_tag=se&keywords=bags&qid=1727241139&sprefix=ba%2Caps%2C283&sr=8-95,Wildcraft New Polyester 28 liters laptop Casual Backpack (BLUE),"₹1,680",3.8 out of 5 stars,19,Not found,B09LRBBVSL,wildcraft new polyester 28 liter laptop casual backpack blue
https://www.amazon.in/Boldfit-Essentials-Accessories-Waterproof-Dustproof/dp/B0D1CNN4MG/ref=sr_1_96?crid=2M096C61O4MLT&dib=eyJ2IjoiMSJ9.UI7UzFmR6jL3DCyDWcD60Eu5TDz8FdpCgo__0Ob_XZxnHTBdTAaPjN41YYa6YdGJ5tB8y3vxQwc5wuYGtFOFnzl2aSEkbdPpzKwoFq9AypHIDmhZj9XnwS9Iu1V1UaDuKmebN973pYXimuSdlJuYN32tfjSEr-A_CFz8bUucOyS_KyX8tDJYjQPlitgPQEJcOZ4go6zZu2TxDEVBeE1Ys44dbMC7IM2GYh6UdDfTX7k.pfQU9auW-p7tUtJ4SL6RO6nUNhJcMOO3hX8l4PlN8QU&dib_tag=se&keywords=bags&qid=1727241139&sprefix=ba%2Caps%2C283&sr=8-96,Boldfit Rain Cover for Backpack Travel Essentials Rain Cover for Bag Backpack Rain Cover Travel Accessories Bag Rain Cover Waterproof Dustproof for All Bag Sizes Upto 45Ltrs Rain Cover Bag Black,₹169,4.1 out of 5 stars,420,"Boldfit, Boldfit, Bangalore, 560041,support@boldfit.in,08043702806",‎B0D1CNN4MG,boldfit rain cover backpack travel essential rain cover bag backpack rain cover travel accessory bag rain cover waterproof dustproof bag size upto 45ltrs rain cover bag black
https://www.amazon.in/Newtone-Premium-OXO-Biodegradable-Garbage/dp/B08M5S2NQM/ref=sr_1_97?crid=2M096C61O4MLT&dib=eyJ2IjoiMSJ9.mgURijc8WZsJWLPXwBGG4dw7I8yUQU-k7B4xyI201jFqTdRy4P4LBL3WsNMrCIyCzf9vKw0bDudEuzw3QTQjgQKJKlLm8ZtId0FxsC3RtfozYM9yrsb5pynXk_-ZmfE1YypHHzQywgquKZSMzT2TfWnRhhauj2iLmAdIg-CEPf9iDmzKFQ9K0ofzOq14-F_tAoORW4flWK_YOyHkXCMutfuZ-a0r6QymrXFDCtcSqIY.NXAPo6t6pfenvClBlwyGM6jTFRmiB8AKBnw_pJ1VmLg&dib_tag=se&keywords=bags&qid=1727241202&sprefix=ba%2Caps%2C283&sr=8-97,Newtone Premium Garbage Bags Size 17 X 19 Inches (Small) 180 Bags (6 Rolls) Dustbin Bag/Trash Bag - Green Color,₹202,4.2 out of 5 stars,"2,575","Shalimar Plastic Industries, Daman, Supertex Woven Industries, Daman",B08M5S2NQM,newtone premium garbage bag size 17 x 19 inch small 180 bag 6 roll dustbin bag trash bag green color
https://www.amazon.in/Perpetual-Garbage-Medium-Dustbin-Covers/dp/B0CV5KLM16/ref=sr_1_98?crid=2M096C61O4MLT&dib=eyJ2IjoiMSJ9.mgURijc8WZsJWLPXwBGG4dw7I8yUQU-k7B4xyI201jFqTdRy4P4LBL3WsNMrCIyCzf9vKw0bDudEuzw3QTQjgQKJKlLm8ZtId0FxsC3RtfozYM9yrsb5pynXk_-ZmfE1YypHHzQywgquKZSMzT2TfWnRhhauj2iLmAdIg-CEPf9iDmzKFQ9K0ofzOq14-F_tAoORW4flWK_YOyHkXCMutfuZ-a0r6QymrXFDCtcSqIY.NXAPo6t6pfenvClBlwyGM6jTFRmiB8AKBnw_pJ1VmLg&dib_tag=se&keywords=bags&qid=1727241202&sprefix=ba%2Caps%2C283&sr=8-98,Perpetual Garbage Bags | Medium 90 Pcs (30 Pcs x Pack of 3 Rolls) | | Dustbin Covers for Wet & Dry Waste - (Black-19 x 21 Inch),₹143,3.3 out of 5 stars,307,"S S TRADEMART, TONK ROAD, JAIPUR- 9460389367, S S TRADEMART, TONK ROAD, JAIPUR- 9460389367",‎B0CV5KLM16,perpetual garbage bag medium 90 pc 30 pc x pack 3 roll dustbin cover wet dry waste black 19 x 21 inch
https://www.amazon.in/wolpin-Reusable-Shopping-Grocery-Shoulder/dp/B0CKQ1CM9W/ref=sr_1_99?crid=2M096C61O4MLT&dib=eyJ2IjoiMSJ9.mgURijc8WZsJWLPXwBGG4dw7I8yUQU-k7B4xyI201jFqTdRy4P4LBL3WsNMrCIyCzf9vKw0bDudEuzw3QTQjgQKJKlLm8ZtId0FxsC3RtfozYM9yrsb5pynXk_-ZmfE1YypHHzQywgquKZSMzT2TfWnRhhauj2iLmAdIg-CEPf9iDmzKFQ9K0ofzOq14-F_tAoORW4flWK_YOyHkXCMutfuZ-a0r6QymrXFDCtcSqIY.NXAPo6t6pfenvClBlwyGM6jTFRmiB8AKBnw_pJ1VmLg&dib_tag=se&keywords=bags&qid=1727241202&sprefix=ba%2Caps%2C283&sr=8-99,wolpin Reusable Shopping Bag Canvas Tote Bag for Grocery Shoulder Handbag Travel Bag for Men and Women,₹198,4.5 out of 5 stars,130,WOLTOP INDIA PVT LTD,B0CKQ1CM9W,wolpin reusable shopping bag canvas tote bag grocery shoulder handbag travel bag men woman
https://www.amazon.in/Backpacks-Everyday-Daypack-Adventures-Multicolor/dp/B0D29M2CTN/ref=sr_1_100?crid=2M096C61O4MLT&dib=eyJ2IjoiMSJ9.mgURijc8WZsJWLPXwBGG4dw7I8yUQU-k7B4xyI201jFqTdRy4P4LBL3WsNMrCIyCzf9vKw0bDudEuzw3QTQjgQKJKlLm8ZtId0FxsC3RtfozYM9yrsb5pynXk_-ZmfE1YypHHzQywgquKZSMzT2TfWnRhhauj2iLmAdIg-CEPf9iDmzKFQ9K0ofzOq14-F_tAoORW4flWK_YOyHkXCMutfuZ-a0r6QymrXFDCtcSqIY.NXAPo6t6pfenvClBlwyGM6jTFRmiB8AKBnw_pJ1VmLg&dib_tag=se&keywords=bags&qid=1727241202&sprefix=ba%2Caps%2C283&sr=8-100,"Onego 22 Liter Backpacks Everyday Daypack Ideal For Library, Office, And Outdoor Adventures For Men & Women Boys & Girls, Multicolor",₹299,3.2 out of 5 stars,7,"onego enterprises, Onego Enterprises",B0D29M2CTN,onego 22 liter backpack everyday daypack ideal library office outdoor adventure men woman boy girl multicolor
https://www.amazon.in/ADAAZEL-Tiranga-Durable-Backpacks-Airport/dp/B0CF3MYVBN/ref=sr_1_101?crid=2M096C61O4MLT&dib=eyJ2IjoiMSJ9.mgURijc8WZsJWLPXwBGG4dw7I8yUQU-k7B4xyI201jFqTdRy4P4LBL3WsNMrCIyCzf9vKw0bDudEuzw3QTQjgQKJKlLm8ZtId0FxsC3RtfozYM9yrsb5pynXk_-ZmfE1YypHHzQywgquKZSMzT2TfWnRhhauj2iLmAdIg-CEPf9iDmzKFQ9K0ofzOq14-F_tAoORW4flWK_YOyHkXCMutfuZ-a0r6QymrXFDCtcSqIY.NXAPo6t6pfenvClBlwyGM6jTFRmiB8AKBnw_pJ1VmLg&dib_tag=se&keywords=bags&qid=1727241202&sprefix=ba%2Caps%2C283&sr=8-101,ADAAZEL medium 45 L Tiranga Durable Fancy Modern Unisex school bags ofice bags | Travel Laptop Bags Backpacks Airport Green,₹399,3.6 out of 5 stars,74,"Adaazel Enterprises, Adaazel Enterprises - 7507035000",B0CF3MYVBN,adaazel medium 45 l tiranga durable fancy modern unisex school bag ofice bag travel laptop bag backpack airport green
https://www.amazon.in/Lunars-Bingo-Laptop-Resistant-48L/dp/B08YZ8FFBZ/ref=sr_1_102?crid=2M096C61O4MLT&dib=eyJ2IjoiMSJ9.mgURijc8WZsJWLPXwBGG4dw7I8yUQU-k7B4xyI201jFqTdRy4P4LBL3WsNMrCIyCzf9vKw0bDudEuzw3QTQjgQKJKlLm8ZtId0FxsC3RtfozYM9yrsb5pynXk_-ZmfE1YypHHzQywgquKZSMzT2TfWnRhhauj2iLmAdIg-CEPf9iDmzKFQ9K0ofzOq14-F_tAoORW4flWK_YOyHkXCMutfuZ-a0r6QymrXFDCtcSqIY.NXAPo6t6pfenvClBlwyGM6jTFRmiB8AKBnw_pJ1VmLg&dib_tag=se&keywords=bags&qid=1727241202&sprefix=ba%2Caps%2C283&sr=8-102,Lunar's Bingo - 48 L Laptop Office/School/Travel/Business Backpack Water Resistant - Fits Up to 15.6 Inch Laptop Notebook with 1 Year Warranty,₹899,4.0 out of 5 stars,"12,105","Akshaya Rubbers, Hebbal Industrial Area, Mysore, 7022982998",B08YZ8FFBZ,lunar bingo 48 l laptop office school travel business backpack water resistant fit 15 6 inch laptop notebook 1 year warranty
https://www.amazon.in/Boldfit-Essentials-Accessories-Waterproof-Dustproof/dp/B0D1CNN4MG/ref=sr_1_103?crid=2M096C61O4MLT&dib=eyJ2IjoiMSJ9.mgURijc8WZsJWLPXwBGG4dw7I8yUQU-k7B4xyI201jFqTdRy4P4LBL3WsNMrCIyCzf9vKw0bDudEuzw3QTQjgQKJKlLm8ZtId0FxsC3RtfozYM9yrsb5pynXk_-ZmfE1YypHHzQywgquKZSMzT2TfWnRhhauj2iLmAdIg-CEPf9iDmzKFQ9K0ofzOq14-F_tAoORW4flWK_YOyHkXCMutfuZ-a0r6QymrXFDCtcSqIY.NXAPo6t6pfenvClBlwyGM6jTFRmiB8AKBnw_pJ1VmLg&dib_tag=se&keywords=bags&qid=1727241202&sprefix=ba%2Caps%2C283&sr=8-103,Boldfit Rain Cover for Backpack Travel Essentials Rain Cover for Bag Backpack Rain Cover Travel Accessories Bag Rain Cover Waterproof Dustproof for All Bag Sizes Upto 45Ltrs Rain Cover Bag Black,₹169,4.1 out of 5 stars,420,"Boldfit, Boldfit, Bangalore, 560041,support@boldfit.in,08043702806",‎B0D1CNN4MG,boldfit rain cover backpack travel essential rain cover bag backpack rain cover travel accessory bag rain cover waterproof dustproof bag size upto 45ltrs rain cover bag black
https://www.amazon.in/ZOUK-Printed-Handmade-Leather-handles/dp/B07NHYLTY7/ref=sr_1_104?crid=2M096C61O4MLT&dib=eyJ2IjoiMSJ9.mgURijc8WZsJWLPXwBGG4dw7I8yUQU-k7B4xyI201jFqTdRy4P4LBL3WsNMrCIyCzf9vKw0bDudEuzw3QTQjgQKJKlLm8ZtId0FxsC3RtfozYM9yrsb5pynXk_-ZmfE1YypHHzQywgquKZSMzT2TfWnRhhauj2iLmAdIg-CEPf9iDmzKFQ9K0ofzOq14-F_tAoORW4flWK_YOyHkXCMutfuZ-a0r6QymrXFDCtcSqIY.NXAPo6t6pfenvClBlwyGM6jTFRmiB8AKBnw_pJ1VmLg&dib_tag=se&keywords=bags&qid=1727241202&sprefix=ba%2Caps%2C283&sr=8-104,"ZOUK Vegan Leather Women's Office Bag for 15.6 inch Laptop, MacBook","₹1,499",4.3 out of 5 stars,"5,005","Seaturtle Pvt. Ltd. Thakur Compound, 2nd Floor, 3, USV Lane, Deonar, Mumbai, Maharashtra 400088, Sea Turtle Pvt Ltd, Near Kalher Village, Building No 1-6/H No 196/Gala No 1-5, 1st Floor, Shree Arihant Complex, Bhiwandi Road, Kopar, Bhiwandi, Thane, Maharashtra - 421302",B07NHYLTY7,zouk vegan leather woman office bag 15 6 inch laptop macbook
https://www.amazon.in/SHALIMAR-Capacity-Travel-Storage-Duffel/dp/B0BZZ3Q811/ref=sr_1_105?crid=2M096C61O4MLT&dib=eyJ2IjoiMSJ9.mgURijc8WZsJWLPXwBGG4dw7I8yUQU-k7B4xyI201jFqTdRy4P4LBL3WsNMrCIyCzf9vKw0bDudEuzw3QTQjgQKJKlLm8ZtId0FxsC3RtfozYM9yrsb5pynXk_-ZmfE1YypHHzQywgquKZSMzT2TfWnRhhauj2iLmAdIg-CEPf9iDmzKFQ9K0ofzOq14-F_tAoORW4flWK_YOyHkXCMutfuZ-a0r6QymrXFDCtcSqIY.NXAPo6t6pfenvClBlwyGM6jTFRmiB8AKBnw_pJ1VmLg&dib_tag=se&keywords=bags&qid=1727241202&sprefix=ba%2Caps%2C283&sr=8-105,"Shalimar Large Capacity Travel Bag/Storage Bag/Move-in Bags/Duffel Bag - Strong, Durable, Foldable and Water Resistant (Pack of - 2) - Black (62.23 L x 30.48 W x 35.56 H)",₹508,4.4 out of 5 stars,181,Not found,Not found,shalimar large capacity travel bag storage bag move bag duffel bag strong durable foldable water resistant pack 2 black 62 23 l x 30 48 w x 35 56 h
https://www.amazon.in/Girls-1522-Polyester-Designer-Waterproof-Bag-Backpack/dp/B08F9SFYXQ/ref=sr_1_106?crid=2M096C61O4MLT&dib=eyJ2IjoiMSJ9.mgURijc8WZsJWLPXwBGG4dw7I8yUQU-k7B4xyI201jFqTdRy4P4LBL3WsNMrCIyCzf9vKw0bDudEuzw3QTQjgQKJKlLm8ZtId0FxsC3RtfozYM9yrsb5pynXk_-ZmfE1YypHHzQywgquKZSMzT2TfWnRhhauj2iLmAdIg-CEPf9iDmzKFQ9K0ofzOq14-F_tAoORW4flWK_YOyHkXCMutfuZ-a0r6QymrXFDCtcSqIY.NXAPo6t6pfenvClBlwyGM6jTFRmiB8AKBnw_pJ1VmLg&dib_tag=se&keywords=bags&qid=1727241202&sprefix=ba%2Caps%2C283&sr=8-106,BEAUTY GIRLS BY HOTSHOT 1522|School Bag|Tuition Bag|College Backpack|ForGirls&Women|Waterproof Bag,₹679,4.2 out of 5 stars,"2,553","Shri Salasar Enterprises, Customer care no : 18003099472 contact@hotshotbags.com",B08F9SFYXQ,beauty girl hotshot 1522 school bag tuition bag college backpack forgirls woman waterproof bag
https://www.amazon.in/Kuber-Industries-Organiser-Wardrobe-Transparent/dp/B084826MP5/ref=sr_1_107?crid=2M096C61O4MLT&dib=eyJ2IjoiMSJ9.mgURijc8WZsJWLPXwBGG4dw7I8yUQU-k7B4xyI201jFqTdRy4P4LBL3WsNMrCIyCzf9vKw0bDudEuzw3QTQjgQKJKlLm8ZtId0FxsC3RtfozYM9yrsb5pynXk_-ZmfE1YypHHzQywgquKZSMzT2TfWnRhhauj2iLmAdIg-CEPf9iDmzKFQ9K0ofzOq14-F_tAoORW4flWK_YOyHkXCMutfuZ-a0r6QymrXFDCtcSqIY.NXAPo6t6pfenvClBlwyGM6jTFRmiB8AKBnw_pJ1VmLg&dib_tag=se&keywords=bags&qid=1727241202&sprefix=ba%2Caps%2C283&sr=8-107,Kuber Industries Polka Dots Design Non-woven Foldable Saree Cover|Clothes Storage Bag/Wardrobe Organizer|Zipper Closer With Transparent Window|Size 46 x 32 x 22 CM|Pack of 3 (Black & White),₹186,4.0 out of 5 stars,"2,646",Not found,Not found,kuber industry polka dot design non woven foldable saree cover clothes storage bag wardrobe organizer zipper closer transparent window size 46 x 32 x 22 cm pack 3 black white
https://www.amazon.in/G-1-Medium-Disposable-Garbage-Dustbin/dp/B077RJ1YMW/ref=sr_1_108?crid=2M096C61O4MLT&dib=eyJ2IjoiMSJ9.mgURijc8WZsJWLPXwBGG4dw7I8yUQU-k7B4xyI201jFqTdRy4P4LBL3WsNMrCIyCzf9vKw0bDudEuzw3QTQjgQKJKlLm8ZtId0FxsC3RtfozYM9yrsb5pynXk_-ZmfE1YypHHzQywgquKZSMzT2TfWnRhhauj2iLmAdIg-CEPf9iDmzKFQ9K0ofzOq14-F_tAoORW4flWK_YOyHkXCMutfuZ-a0r6QymrXFDCtcSqIY.NXAPo6t6pfenvClBlwyGM6jTFRmiB8AKBnw_pJ1VmLg&dib_tag=se&keywords=bags&qid=1727241202&sprefix=ba%2Caps%2C283&sr=8-108,G1 Garbage Bags | Dustbin Bags | Medium | Black | 19 X 21 Inch | 4 Packs Of 30 pcs 120 pcs,₹192,4.2 out of 5 stars,"17,266","Shaktiman Enterprises, Shaktiman Enterprises, Village Dadra, DN 396193, shaktimanenterprises9@gmail.com, 9930059321",B077RJ1YMW,g1 garbage bag dustbin bag medium black 19 x 21 inch 4 pack 30 pc 120 pc
https://www.amazon.in/Safari-Overnighter-Resistant-Travelling-All-Purpose/dp/B07BZ5VC4H/ref=sr_1_109?crid=2M096C61O4MLT&dib=eyJ2IjoiMSJ9.mgURijc8WZsJWLPXwBGG4dw7I8yUQU-k7B4xyI201jFqTdRy4P4LBL3WsNMrCIyCzf9vKw0bDudEuzw3QTQjgQKJKlLm8ZtId0FxsC3RtfozYM9yrsb5pynXk_-ZmfE1YypHHzQywgquKZSMzT2TfWnRhhauj2iLmAdIg-CEPf9iDmzKFQ9K0ofzOq14-F_tAoORW4flWK_YOyHkXCMutfuZ-a0r6QymrXFDCtcSqIY.NXAPo6t6pfenvClBlwyGM6jTFRmiB8AKBnw_pJ1VmLg&dib_tag=se&keywords=bags&qid=1727241202&sprefix=ba%2Caps%2C283&sr=8-109,"Safari Seek 45L Expandable Overnighter Laptop Backpack with Suitcase Compartment, Compression Straps & Raincover, Travel Bag for Men and Women, Ideal for Outdoor Use, Office, College, Color – Black","₹2,299",4.4 out of 5 stars,"9,202","Safari, Safari Industries Ltd 301/302, A-Wing, The Qube, M.V.Road, Marol, Andheri(East), Near international Airport Mumbai- 400059 +91-22-40381851/838",B07BZ5VC4H,safari seek 45l expandable overnighter laptop backpack suitcase compartment compression strap raincover travel bag men woman ideal outdoor use office college color black
https://www.amazon.in/Wildcraft-Black-Casual-Backpack-11947/dp/B07N2LC749/ref=sr_1_110_mod_primary_new?crid=2M096C61O4MLT&dib=eyJ2IjoiMSJ9.mgURijc8WZsJWLPXwBGG4dw7I8yUQU-k7B4xyI201jFqTdRy4P4LBL3WsNMrCIyCzf9vKw0bDudEuzw3QTQjgQKJKlLm8ZtId0FxsC3RtfozYM9yrsb5pynXk_-ZmfE1YypHHzQywgquKZSMzT2TfWnRhhauj2iLmAdIg-CEPf9iDmzKFQ9K0ofzOq14-F_tAoORW4flWK_YOyHkXCMutfuZ-a0r6QymrXFDCtcSqIY.NXAPo6t6pfenvClBlwyGM6jTFRmiB8AKBnw_pJ1VmLg&dib_tag=se&keywords=bags&qid=1727241202&sbo=RZvfv%2F%2FHxDF%2BO5021pAnSA%3D%3D&sprefix=ba%2Caps%2C283&sr=8-110,"Wildcraft 29.5 Ltrs Black Casual Standard Backpack (11947 Black) (Medium Size), 29.5 Litre",₹990,4.2 out of 5 stars,"1,255",Not found,Not found,wildcraft 29 5 ltrs black casual standard backpack 11947 black medium size 29 5 litre
https://www.amazon.in/Skybags-Cardiff-Polyester-Travel-DFCAR55BLU/dp/B073JYDK7P/ref=sr_1_111?crid=2M096C61O4MLT&dib=eyJ2IjoiMSJ9.mgURijc8WZsJWLPXwBGG4dw7I8yUQU-k7B4xyI201jFqTdRy4P4LBL3WsNMrCIyCzf9vKw0bDudEuzw3QTQjgQKJKlLm8ZtId0FxsC3RtfozYM9yrsb5pynXk_-ZmfE1YypHHzQywgquKZSMzT2TfWnRhhauj2iLmAdIg-CEPf9iDmzKFQ9K0ofzOq14-F_tAoORW4flWK_YOyHkXCMutfuZ-a0r6QymrXFDCtcSqIY.NXAPo6t6pfenvClBlwyGM6jTFRmiB8AKBnw_pJ1VmLg&dib_tag=se&keywords=bags&qid=1727241202&sprefix=ba%2Caps%2C283&sr=8-111,Skybags Polyester Blue Softsided Luggage Set,₹849,4.2 out of 5 stars,"10,634","VIP Industries Ltd, VIP Industries Ltd, DGP House, 5 th Floor, 88C Old Prabhadevi Road, Mumbai, Maharashtra - 400025; 24X7 Toll Free Helpline No. 1800-1022-256",B073JYDK7P,skybags polyester blue softsided luggage set
https://www.amazon.in/HYDER-Astronaut-Waterproof-Lightweight-Backpack/dp/B0BJ5T55XY/ref=sr_1_112?crid=2M096C61O4MLT&dib=eyJ2IjoiMSJ9.mgURijc8WZsJWLPXwBGG4dw7I8yUQU-k7B4xyI201jFqTdRy4P4LBL3WsNMrCIyCzf9vKw0bDudEuzw3QTQjgQKJKlLm8ZtId0FxsC3RtfozYM9yrsb5pynXk_-ZmfE1YypHHzQywgquKZSMzT2TfWnRhhauj2iLmAdIg-CEPf9iDmzKFQ9K0ofzOq14-F_tAoORW4flWK_YOyHkXCMutfuZ-a0r6QymrXFDCtcSqIY.NXAPo6t6pfenvClBlwyGM6jTFRmiB8AKBnw_pJ1VmLg&dib_tag=se&keywords=bags&qid=1727241202&sprefix=ba%2Caps%2C283&sr=8-112,HYDER Kids 20L Seamless Printed Cartoon Best Stylish Waterproof Lightweight Casual/Picnic/Tuition/School Bag/Backpack for Children Boys And Girls,₹469,4.1 out of 5 stars,"1,352","Bharat Engineering Company Add: 138, Yadgarpur, Kila Road, Meerut, Bharat Engineering Company Add: 138, Yadgarpur, Kila Road, Meerut, Contact: +91-9557636884, commerce.hyder@gmail.com",B0BJ5T55XY,hyder kid 20l seamless printed cartoon best stylish waterproof lightweight casual picnic tuition school bag backpack child boy girl
https://www.amazon.in/American-Tourister-AMT-SCH-02/dp/B07CJCGM1M/ref=sr_1_113?crid=2M096C61O4MLT&dib=eyJ2IjoiMSJ9.QNTYRdn-0oZHwPnRVqjbcv9PbKNggsDBwi6PHUKw_04OrnJaBpIkPA_JmmmBVNcQMPWlET27w7nJMgIn-OZfCMpYsyk_119nbxCs_BAtTGyodR6omcV7QkKAY3CAqnxtREUcuu8uPfjv9Ka3dNU2qznz9Mk8My4uZoMiZG8MgL4R1qyn-Dfqn6AsfyrgCSltGxB4yyEjenxOUNz42CzScWfuh1br0aM8kWdxs6tHnFA.EwJ_zoduwHITTqumr9D6sdNfj6bsISRNxnY5y87DUSk&dib_tag=se&keywords=bags&qid=1727241257&sprefix=ba%2Caps%2C283&sr=8-113,"American Tourister Fizz Backpack School bag for travel with Organizer Bottle compartment water resistant backpack for Men, Women, Boys Laptop Backpack for College Gift for Men & Women","₹1,299",4.0 out of 5 stars,"51,351","Samsonite, American Tourister",B07CJCGM1M,american tourister fizz backpack school bag travel organizer bottle compartment water resistant backpack men woman boy laptop backpack college gift men woman
https://www.amazon.in/Kuber-Industries-Organiser-Wardrobe-Transparent/dp/B084826MP5/ref=sr_1_114?crid=2M096C61O4MLT&dib=eyJ2IjoiMSJ9.QNTYRdn-0oZHwPnRVqjbcv9PbKNggsDBwi6PHUKw_04OrnJaBpIkPA_JmmmBVNcQMPWlET27w7nJMgIn-OZfCMpYsyk_119nbxCs_BAtTGyodR6omcV7QkKAY3CAqnxtREUcuu8uPfjv9Ka3dNU2qznz9Mk8My4uZoMiZG8MgL4R1qyn-Dfqn6AsfyrgCSltGxB4yyEjenxOUNz42CzScWfuh1br0aM8kWdxs6tHnFA.EwJ_zoduwHITTqumr9D6sdNfj6bsISRNxnY5y87DUSk&dib_tag=se&keywords=bags&qid=1727241257&sprefix=ba%2Caps%2C283&sr=8-114,Kuber Industries Polka Dots Design Non-woven Foldable Saree Cover|Clothes Storage Bag/Wardrobe Organizer|Zipper Closer With Transparent Window|Size 46 x 32 x 22 CM|Pack of 3 (Black & White),₹186,4.0 out of 5 stars,"2,646",Not found,Not found,kuber industry polka dot design non woven foldable saree cover clothes storage bag wardrobe organizer zipper closer transparent window size 46 x 32 x 22 cm pack 3 black white
https://www.amazon.in/ZOUK-Printed-Handmade-Leather-handles/dp/B07NHYLTY7/ref=sr_1_115?crid=2M096C61O4MLT&dib=eyJ2IjoiMSJ9.QNTYRdn-0oZHwPnRVqjbcv9PbKNggsDBwi6PHUKw_04OrnJaBpIkPA_JmmmBVNcQMPWlET27w7nJMgIn-OZfCMpYsyk_119nbxCs_BAtTGyodR6omcV7QkKAY3CAqnxtREUcuu8uPfjv9Ka3dNU2qznz9Mk8My4uZoMiZG8MgL4R1qyn-Dfqn6AsfyrgCSltGxB4yyEjenxOUNz42CzScWfuh1br0aM8kWdxs6tHnFA.EwJ_zoduwHITTqumr9D6sdNfj6bsISRNxnY5y87DUSk&dib_tag=se&keywords=bags&qid=1727241257&sprefix=ba%2Caps%2C283&sr=8-115,"ZOUK Vegan Leather Women's Office Bag for 15.6 inch Laptop, MacBook","₹1,499",4.3 out of 5 stars,"5,005",Not found,Not found,zouk vegan leather woman office bag 15 6 inch laptop macbook
https://www.amazon.in/Wesley-Milestone-Waterproof-Backpack-Business/dp/B085S444JV/ref=sr_1_116?crid=2M096C61O4MLT&dib=eyJ2IjoiMSJ9.QNTYRdn-0oZHwPnRVqjbcv9PbKNggsDBwi6PHUKw_04OrnJaBpIkPA_JmmmBVNcQMPWlET27w7nJMgIn-OZfCMpYsyk_119nbxCs_BAtTGyodR6omcV7QkKAY3CAqnxtREUcuu8uPfjv9Ka3dNU2qznz9Mk8My4uZoMiZG8MgL4R1qyn-Dfqn6AsfyrgCSltGxB4yyEjenxOUNz42CzScWfuh1br0aM8kWdxs6tHnFA.EwJ_zoduwHITTqumr9D6sdNfj6bsISRNxnY5y87DUSk&dib_tag=se&keywords=bags&qid=1727241257&sprefix=ba%2Caps%2C283&sr=8-116,"Wesley Milestone 2.0 Casual Waterproof Laptop Backpack/Office Bag/School Bag/College Bag/Travel Backpack (Dimensions:13x18 inches) (Compatible with 39.62cm(15.6inch Laptop) 30 L, Charcoal Black",₹484,4.3 out of 5 stars,"16,776",Not found,Not found,wesley milestone 2 0 casual waterproof laptop backpack office bag school bag college bag travel backpack dimension 13x18 inch compatible 39 62cm 15 6inch laptop 30 l charcoal black
https://www.amazon.in/Backpack-compartments-premium-polyester-college/dp/B097JLPCPQ/ref=sr_1_117?crid=2M096C61O4MLT&dib=eyJ2IjoiMSJ9.QNTYRdn-0oZHwPnRVqjbcv9PbKNggsDBwi6PHUKw_04OrnJaBpIkPA_JmmmBVNcQMPWlET27w7nJMgIn-OZfCMpYsyk_119nbxCs_BAtTGyodR6omcV7QkKAY3CAqnxtREUcuu8uPfjv9Ka3dNU2qznz9Mk8My4uZoMiZG8MgL4R1qyn-Dfqn6AsfyrgCSltGxB4yyEjenxOUNz42CzScWfuh1br0aM8kWdxs6tHnFA.EwJ_zoduwHITTqumr9D6sdNfj6bsISRNxnY5y87DUSk&dib_tag=se&keywords=bags&qid=1727241257&sprefix=ba%2Caps%2C283&sr=8-117,"SAFARI Quirk 30L Laptop Backpack, 2 compartments, premium polyester fabric, bottle holder, school bag for boys and girls, college bag for women and men, office bag, travel bag, Color- Blue",₹766,Not found,Not found,"Safari, Safari Industries Ltd 301/302, A-Wing, The Qube, M.V.Road, Marol, Andheri(East), Near international Airport Mumbai- 400059 +91-22-40381851/838",B097JLPCPQ,safari quirk 30l laptop backpack 2 compartment premium polyester fabric bottle holder school bag boy girl college bag woman men office bag travel bag color blue
https://www.amazon.in/Skybags-Cardiff-Polyester-Travel-DFCAR55BLU/dp/B073JYDK7P/ref=sr_1_118?crid=2M096C61O4MLT&dib=eyJ2IjoiMSJ9.QNTYRdn-0oZHwPnRVqjbcv9PbKNggsDBwi6PHUKw_04OrnJaBpIkPA_JmmmBVNcQMPWlET27w7nJMgIn-OZfCMpYsyk_119nbxCs_BAtTGyodR6omcV7QkKAY3CAqnxtREUcuu8uPfjv9Ka3dNU2qznz9Mk8My4uZoMiZG8MgL4R1qyn-Dfqn6AsfyrgCSltGxB4yyEjenxOUNz42CzScWfuh1br0aM8kWdxs6tHnFA.EwJ_zoduwHITTqumr9D6sdNfj6bsISRNxnY5y87DUSk&dib_tag=se&keywords=bags&qid=1727241257&sprefix=ba%2Caps%2C283&sr=8-118,Skybags Polyester Blue Softsided Luggage Set,₹849,4.2 out of 5 stars,"10,634",Not found,Not found,skybags polyester blue softsided luggage set
https://www.amazon.in/G-1-Medium-Disposable-Garbage-Dustbin/dp/B077RJ1YMW/ref=sr_1_119?crid=2M096C61O4MLT&dib=eyJ2IjoiMSJ9.QNTYRdn-0oZHwPnRVqjbcv9PbKNggsDBwi6PHUKw_04OrnJaBpIkPA_JmmmBVNcQMPWlET27w7nJMgIn-OZfCMpYsyk_119nbxCs_BAtTGyodR6omcV7QkKAY3CAqnxtREUcuu8uPfjv9Ka3dNU2qznz9Mk8My4uZoMiZG8MgL4R1qyn-Dfqn6AsfyrgCSltGxB4yyEjenxOUNz42CzScWfuh1br0aM8kWdxs6tHnFA.EwJ_zoduwHITTqumr9D6sdNfj6bsISRNxnY5y87DUSk&dib_tag=se&keywords=bags&qid=1727241257&sprefix=ba%2Caps%2C283&sr=8-119,G1 Garbage Bags | Dustbin Bags | Medium | Black | 19 X 21 Inch | 4 Packs Of 30 pcs 120 pcs,₹192,4.2 out of 5 stars,"17,266",Not found,Not found,g1 garbage bag dustbin bag medium black 19 x 21 inch 4 pack 30 pc 120 pc
https://www.amazon.in/Dyazo-Business-Backpack-Resistant-laptops/dp/B0BRKBKKLY/ref=sr_1_120?crid=2M096C61O4MLT&dib=eyJ2IjoiMSJ9.QNTYRdn-0oZHwPnRVqjbcv9PbKNggsDBwi6PHUKw_04OrnJaBpIkPA_JmmmBVNcQMPWlET27w7nJMgIn-OZfCMpYsyk_119nbxCs_BAtTGyodR6omcV7QkKAY3CAqnxtREUcuu8uPfjv9Ka3dNU2qznz9Mk8My4uZoMiZG8MgL4R1qyn-Dfqn6AsfyrgCSltGxB4yyEjenxOUNz42CzScWfuh1br0aM8kWdxs6tHnFA.EwJ_zoduwHITTqumr9D6sdNfj6bsISRNxnY5y87DUSk&dib_tag=se&keywords=bags&qid=1727241257&sprefix=ba%2Caps%2C283&sr=8-120,Dyazo 30 L Slim Business Laptop Backpack Casual Design Water Resistant Backpack for laptops for 15.6 inch laptop (Black),₹499,4.0 out of 5 stars,310,Not found,Not found,dyazo 30 l slim business laptop backpack casual design water resistant backpack laptop 15 6 inch laptop black
https://www.amazon.in/HYDER-Astronaut-Waterproof-Lightweight-Backpack/dp/B0BJ5T55XY/ref=sr_1_121?crid=2M096C61O4MLT&dib=eyJ2IjoiMSJ9.QNTYRdn-0oZHwPnRVqjbcv9PbKNggsDBwi6PHUKw_04OrnJaBpIkPA_JmmmBVNcQMPWlET27w7nJMgIn-OZfCMpYsyk_119nbxCs_BAtTGyodR6omcV7QkKAY3CAqnxtREUcuu8uPfjv9Ka3dNU2qznz9Mk8My4uZoMiZG8MgL4R1qyn-Dfqn6AsfyrgCSltGxB4yyEjenxOUNz42CzScWfuh1br0aM8kWdxs6tHnFA.EwJ_zoduwHITTqumr9D6sdNfj6bsISRNxnY5y87DUSk&dib_tag=se&keywords=bags&qid=1727241257&sprefix=ba%2Caps%2C283&sr=8-121,HYDER Kids 20L Seamless Printed Cartoon Best Stylish Waterproof Lightweight Casual/Picnic/Tuition/School Bag/Backpack for Children Boys And Girls,₹469,4.1 out of 5 stars,"1,352",Not found,Not found,hyder kid 20l seamless printed cartoon best stylish waterproof lightweight casual picnic tuition school bag backpack child boy girl
