Product URL,Product Name,Product Price,Rating,Number of reviews,Manufacturer,ASIN,processed_text
https://www.amazon.in/LUMONY%C2%AE-Relief-Sports-Therapy-Multi-Color-9/dp/B07BCF5FCB/ref=sr_1_122?crid=2M096C61O4MLT&dib=eyJ2IjoiMSJ9.QNTYRdn-0oZHwPnRVqjbcv9PbKNggsDBwi6PHUKw_04OrnJaBpIkPA_JmmmBVNcQMPWlET27w7nJMgIn-OZfCMpYsyk_119nbxCs_BAtTGyodR6omcV7QkKAY3CAqnxtREUcuu8uPfjv9Ka3dNU2qznz9Mk8My4uZoMiZG8MgL4R1qyn-Dfqn6AsfyrgCSltGxB4yyEjenxOUNz42CzScWfuh1br0aM8kWdxs6tHnFA.EwJ_zoduwHITTqumr9D6sdNfj6bsISRNxnY5y87DUSk&dib_tag=se&keywords=bags&qid=1727241257&sprefix=ba%2Caps%2C283&sr=8-122,"LUMONY® 9"" Inch Hot Water Bag Ice Bag for Pain Relief Cold Hot Water Bag Ice Pack Bag for Pain Relief Cold Water Bag for Pain Relief First Aid Sports Injury Neck Knee for Pain Relief And Cold Therapy Comes with Leak-free Closure",₹225,4.3 out of 5 stars,"11,424",Not found,Not found,lumony 9 inch hot water bag ice bag pain relief cold hot water bag ice pack bag pain relief cold water bag pain relief first aid sport injury neck knee pain relief cold therapy come leak free closure
https://www.amazon.in/SHALIMAR-Capacity-Travel-Storage-Duffel/dp/B0BZZ3Q811/ref=sr_1_123?crid=2M096C61O4MLT&dib=eyJ2IjoiMSJ9.QNTYRdn-0oZHwPnRVqjbcv9PbKNggsDBwi6PHUKw_04OrnJaBpIkPA_JmmmBVNcQMPWlET27w7nJMgIn-OZfCMpYsyk_119nbxCs_BAtTGyodR6omcV7QkKAY3CAqnxtREUcuu8uPfjv9Ka3dNU2qznz9Mk8My4uZoMiZG8MgL4R1qyn-Dfqn6AsfyrgCSltGxB4yyEjenxOUNz42CzScWfuh1br0aM8kWdxs6tHnFA.EwJ_zoduwHITTqumr9D6sdNfj6bsISRNxnY5y87DUSk&dib_tag=se&keywords=bags&qid=1727241257&sprefix=ba%2Caps%2C283&sr=8-123,"Shalimar Large Capacity Travel Bag/Storage Bag/Move-in Bags/Duffel Bag - Strong, Durable, Foldable and Water Resistant (Pack of - 2) - Black (62.23 L x 30.48 W x 35.56 H)",₹508,4.4 out of 5 stars,181,Not found,Not found,shalimar large capacity travel bag storage bag move bag duffel bag strong durable foldable water resistant pack 2 black 62 23 l x 30 48 w x 35 56 h
https://www.amazon.in/Lunars-Travel-Laptop-Bag-compartments/dp/B08NHH8Q5X/ref=sr_1_124?crid=2M096C61O4MLT&dib=eyJ2IjoiMSJ9.QNTYRdn-0oZHwPnRVqjbcv9PbKNggsDBwi6PHUKw_04OrnJaBpIkPA_JmmmBVNcQMPWlET27w7nJMgIn-OZfCMpYsyk_119nbxCs_BAtTGyodR6omcV7QkKAY3CAqnxtREUcuu8uPfjv9Ka3dNU2qznz9Mk8My4uZoMiZG8MgL4R1qyn-Dfqn6AsfyrgCSltGxB4yyEjenxOUNz42CzScWfuh1br0aM8kWdxs6tHnFA.EwJ_zoduwHITTqumr9D6sdNfj6bsISRNxnY5y87DUSk&dib_tag=se&keywords=bags&qid=1727241257&sprefix=ba%2Caps%2C283&sr=8-124,"Lunar's Unisex 50L Water Resistant Office/Travel/Business Laptop Backpack, Bag for up to 17.3 inch Laptop/MacBook with rain Cover and 2 Large compartments","₹1,199",4.1 out of 5 stars,"3,162",Not found,Not found,lunar unisex 50l water resistant office travel business laptop backpack bag 17 3 inch laptop macbook rain cover 2 large compartment
https://www.amazon.in/NORTH-ZONE-Waterproof-Backpack-Dimensions/dp/B0BS6QM2GD/ref=sr_1_125?crid=2M096C61O4MLT&dib=eyJ2IjoiMSJ9.QNTYRdn-0oZHwPnRVqjbcv9PbKNggsDBwi6PHUKw_04OrnJaBpIkPA_JmmmBVNcQMPWlET27w7nJMgIn-OZfCMpYsyk_119nbxCs_BAtTGyodR6omcV7QkKAY3CAqnxtREUcuu8uPfjv9Ka3dNU2qznz9Mk8My4uZoMiZG8MgL4R1qyn-Dfqn6AsfyrgCSltGxB4yyEjenxOUNz42CzScWfuh1br0aM8kWdxs6tHnFA.EwJ_zoduwHITTqumr9D6sdNfj6bsISRNxnY5y87DUSk&dib_tag=se&keywords=bags&qid=1727241257&sprefix=ba%2Caps%2C283&sr=8-125,NORTH ZONE Casual Waterproof Laptop Backpack/Office Bag/School Bag/College Bag/Business Bag/Travel Backpack (Dimensions:13x18 inches) (Compatible with 39.62cm(15.6inch laptop) 30 L,₹599,4.1 out of 5 stars,"1,340",SHABA BAGS,B0BS6QM2GD,north zone casual waterproof laptop backpack office bag school bag college bag business bag travel backpack dimension 13x18 inch compatible 39 62cm 15 6inch laptop 30 l
https://www.amazon.in/Murano-Casual-daybackpack-Office-College/dp/B0BX9CYJ97/ref=sr_1_126?crid=2M096C61O4MLT&dib=eyJ2IjoiMSJ9.QNTYRdn-0oZHwPnRVqjbcv9PbKNggsDBwi6PHUKw_04OrnJaBpIkPA_JmmmBVNcQMPWlET27w7nJMgIn-OZfCMpYsyk_119nbxCs_BAtTGyodR6omcV7QkKAY3CAqnxtREUcuu8uPfjv9Ka3dNU2qznz9Mk8My4uZoMiZG8MgL4R1qyn-Dfqn6AsfyrgCSltGxB4yyEjenxOUNz42CzScWfuh1br0aM8kWdxs6tHnFA.EwJ_zoduwHITTqumr9D6sdNfj6bsISRNxnY5y87DUSk&dib_tag=se&keywords=bags&qid=1727241257&sprefix=ba%2Caps%2C283&sr=8-126,Murano Louis 10ltr Small Casual day backpack/Office Bag | Travel Bag | School Bag | College Bag | Versatile bag For Men & Women |For Girl & Boy (Black),₹199,3.7 out of 5 stars,745,Not found,Not found,murano louis 10ltr small casual day backpack office bag travel bag school bag college bag versatile bag men woman girl boy black
https://www.amazon.in/Aristocrat-Cadet-Polyester-Travel-Duffle/dp/B07S9GSXVQ/ref=sr_1_127?crid=2M096C61O4MLT&dib=eyJ2IjoiMSJ9.QNTYRdn-0oZHwPnRVqjbcv9PbKNggsDBwi6PHUKw_04OrnJaBpIkPA_JmmmBVNcQMPWlET27w7nJMgIn-OZfCMpYsyk_119nbxCs_BAtTGyodR6omcV7QkKAY3CAqnxtREUcuu8uPfjv9Ka3dNU2qznz9Mk8My4uZoMiZG8MgL4R1qyn-Dfqn6AsfyrgCSltGxB4yyEjenxOUNz42CzScWfuh1br0aM8kWdxs6tHnFA.EwJ_zoduwHITTqumr9D6sdNfj6bsISRNxnY5y87DUSk&dib_tag=se&keywords=bags&qid=1727241257&sprefix=ba%2Caps%2C283&sr=8-127,"Aristocrat Cadet Polyester 52 Cms Wheel Travel Duffle Bag (Blue), 30 Centimeters","₹1,199",4.1 out of 5 stars,"2,076",Not found,Not found,aristocrat cadet polyester 52 cm wheel travel duffle bag blue 30 centimeter
https://www.amazon.in/hub-Waterproof-Lightweight-Expandable-Bag%E3%80%90Colors/dp/B0CRB5C38N/ref=sr_1_128?crid=2M096C61O4MLT&dib=eyJ2IjoiMSJ9.QNTYRdn-0oZHwPnRVqjbcv9PbKNggsDBwi6PHUKw_04OrnJaBpIkPA_JmmmBVNcQMPWlET27w7nJMgIn-OZfCMpYsyk_119nbxCs_BAtTGyodR6omcV7QkKAY3CAqnxtREUcuu8uPfjv9Ka3dNU2qznz9Mk8My4uZoMiZG8MgL4R1qyn-Dfqn6AsfyrgCSltGxB4yyEjenxOUNz42CzScWfuh1br0aM8kWdxs6tHnFA.EwJ_zoduwHITTqumr9D6sdNfj6bsISRNxnY5y87DUSk&dib_tag=se&keywords=bags&qid=1727241257&sprefix=ba%2Caps%2C283&sr=8-128,"Royals hub Unisex-Adult Royal Hub Large Capacity Folding Travel Tote Bag,Oxford Fabric Waterproof Lightweight Foldable Travel Duffel Bag Portable Expandable Travel Bag,Dry And Wet Carry On Bag,Blue",₹398,3.8 out of 5 stars,266,Not found,Not found,royal hub unisex adult royal hub large capacity folding travel tote bag oxford fabric waterproof lightweight foldable travel duffel bag portable expandable travel bag dry wet carry bag blue
https://www.amazon.in/Shalimar-Premium-Garbage-Small-Rolls/dp/B07KT56WHT/ref=sr_1_145?crid=2M096C61O4MLT&dib=eyJ2IjoiMSJ9.sTGIt1-K-kqnHpuH9Y6Il9Prl2lCHrXE6b6IeUD3SoyuaQl-17L4cjd4nVqRHRupshWtj73qJC-xo6s18jjq4G45dUYjUI3C_90G9TWtPeIrawwUvRtOK-vqNTlGYSG0UeqVUmxJ6rkyDeY7eB0yoTbL23VI-k2RXlLIg2lXc1Mh-kwMDj_bzhLGiYl7eyddRDxd3BCKpyti0xE50SYbuvnvXHKJvMZLCxpWvOdUgJI.1oo95XOKxV_kzR3PsEMZtCLcdJtTz-RoDCm4VjJjGG0&dib_tag=se&keywords=bags&qid=1727241280&sprefix=ba%2Caps%2C283&sr=8-145,"Shalimar Premium Garbage Bags Size 17 X 19 Inches (Small) 120 Bags (4 rolls) Dustbin Bag/Trash Bag - Black Color, 120 piece, Plastic",₹207,4.5 out of 5 stars,"7,827",Not found,Not found,shalimar premium garbage bag size 17 x 19 inch small 120 bag 4 roll dustbin bag trash bag black color 120 piece plastic
https://www.amazon.in/HAMMONDS-FLYCATCHER-Laptop-Bag-Men/dp/B0718Z175J/ref=sr_1_146?crid=2M096C61O4MLT&dib=eyJ2IjoiMSJ9.sTGIt1-K-kqnHpuH9Y6Il9Prl2lCHrXE6b6IeUD3SoyuaQl-17L4cjd4nVqRHRupshWtj73qJC-xo6s18jjq4G45dUYjUI3C_90G9TWtPeIrawwUvRtOK-vqNTlGYSG0UeqVUmxJ6rkyDeY7eB0yoTbL23VI-k2RXlLIg2lXc1Mh-kwMDj_bzhLGiYl7eyddRDxd3BCKpyti0xE50SYbuvnvXHKJvMZLCxpWvOdUgJI.1oo95XOKxV_kzR3PsEMZtCLcdJtTz-RoDCm4VjJjGG0&dib_tag=se&keywords=bags&qid=1727241280&sprefix=ba%2Caps%2C283&sr=8-146,"HAMMONDS FLYCATCHER Genuine Leather Office Bag for Men, 15.6 Inch Professional Leather Laptop Bag for Men, Adjustable Strap and Multiple Compartments, Leather Bag for Men - 1 Year Warranty","₹4,772",4.3 out of 5 stars,"3,074",Not found,Not found,hammonds flycatcher genuine leather office bag men 15 6 inch professional leather laptop bag men adjustable strap multiple compartment leather bag men 1 year warranty
https://www.amazon.in/Wooum-Messenger-Water-Resistant-Compartments-Adjustable/dp/B0CX66GLH9/ref=sr_1_147?crid=2M096C61O4MLT&dib=eyJ2IjoiMSJ9.sTGIt1-K-kqnHpuH9Y6Il9Prl2lCHrXE6b6IeUD3SoyuaQl-17L4cjd4nVqRHRupshWtj73qJC-xo6s18jjq4G45dUYjUI3C_90G9TWtPeIrawwUvRtOK-vqNTlGYSG0UeqVUmxJ6rkyDeY7eB0yoTbL23VI-k2RXlLIg2lXc1Mh-kwMDj_bzhLGiYl7eyddRDxd3BCKpyti0xE50SYbuvnvXHKJvMZLCxpWvOdUgJI.1oo95XOKxV_kzR3PsEMZtCLcdJtTz-RoDCm4VjJjGG0&dib_tag=se&keywords=bags&qid=1727241280&sprefix=ba%2Caps%2C283&sr=8-147,"Wooum Sling Bag Croos Body Messenger bag Compact Size 10x8x4 Inch Tgrey, Water-Resistant 4 Zipper Compartments, Adjustable Strap, Tablet Holder, and Large Capacity - mix colors",₹319,4.4 out of 5 stars,39,Not found,Not found,wooum sling bag croos body messenger bag compact size 10x8x4 inch tgrey water resistant 4 zipper compartment adjustable strap tablet holder large capacity mix color
https://www.amazon.in/Aristocrat-Airpro-Polypropylene-Hardsided-Trolley/dp/B0BRN1YWYR/ref=sr_1_148?crid=2M096C61O4MLT&dib=eyJ2IjoiMSJ9.sTGIt1-K-kqnHpuH9Y6Il9Prl2lCHrXE6b6IeUD3SoyuaQl-17L4cjd4nVqRHRupshWtj73qJC-xo6s18jjq4G45dUYjUI3C_90G9TWtPeIrawwUvRtOK-vqNTlGYSG0UeqVUmxJ6rkyDeY7eB0yoTbL23VI-k2RXlLIg2lXc1Mh-kwMDj_bzhLGiYl7eyddRDxd3BCKpyti0xE50SYbuvnvXHKJvMZLCxpWvOdUgJI.1oo95XOKxV_kzR3PsEMZtCLcdJtTz-RoDCm4VjJjGG0&dib_tag=se&keywords=bags&qid=1727241280&sprefix=ba%2Caps%2C283&sr=8-148,"Aristocrat Airpro Cabin 55 Cm(Small) 8 Wheels Trolley Bags for Travel Hard Case Luggage, Lightweight Bag with Combination Lock & Robust Trolley with 7 Years Warranty (Teal Blue)","₹1,799",4.1 out of 5 stars,"4,118",Not found,Not found,aristocrat airpro cabin 55 cm small 8 wheel trolley bag travel hard case luggage lightweight bag combination lock robust trolley 7 year warranty teal blue
https://www.amazon.in/Arctic-Fox-Liters-String-Backpack/dp/B08L6Q9V1H/ref=sr_1_149?crid=2M096C61O4MLT&dib=eyJ2IjoiMSJ9.sTGIt1-K-kqnHpuH9Y6Il9Prl2lCHrXE6b6IeUD3SoyuaQl-17L4cjd4nVqRHRupshWtj73qJC-xo6s18jjq4G45dUYjUI3C_90G9TWtPeIrawwUvRtOK-vqNTlGYSG0UeqVUmxJ6rkyDeY7eB0yoTbL23VI-k2RXlLIg2lXc1Mh-kwMDj_bzhLGiYl7eyddRDxd3BCKpyti0xE50SYbuvnvXHKJvMZLCxpWvOdUgJI.1oo95XOKxV_kzR3PsEMZtCLcdJtTz-RoDCm4VjJjGG0&dib_tag=se&keywords=bags&qid=1727241280&sprefix=ba%2Caps%2C283&sr=8-149,Arctic Fox 15 Liters Draw String Backpack,₹207,4.2 out of 5 stars,"3,534",Not found,Not found,arctic fox 15 liter draw string backpack
https://www.amazon.in/American-Tourister-ACTON-Laptop-Backpack/dp/B0C5M24GVM/ref=sr_1_150?crid=2M096C61O4MLT&dib=eyJ2IjoiMSJ9.sTGIt1-K-kqnHpuH9Y6Il9Prl2lCHrXE6b6IeUD3SoyuaQl-17L4cjd4nVqRHRupshWtj73qJC-xo6s18jjq4G45dUYjUI3C_90G9TWtPeIrawwUvRtOK-vqNTlGYSG0UeqVUmxJ6rkyDeY7eB0yoTbL23VI-k2RXlLIg2lXc1Mh-kwMDj_bzhLGiYl7eyddRDxd3BCKpyti0xE50SYbuvnvXHKJvMZLCxpWvOdUgJI.1oo95XOKxV_kzR3PsEMZtCLcdJtTz-RoDCm4VjJjGG0&dib_tag=se&keywords=bags&qid=1727241280&sprefix=ba%2Caps%2C283&sr=8-150,"American Tourister ACTON Laptop Backpack, 33L with Spacious Interiors and Multiple Compartments with Rain Cover, Laptop Backpack for Men and Women - GREY, Gifts for Men, Women and Kids, College Bag","₹1,699",4.0 out of 5 stars,144,Not found,Not found,american tourister acton laptop backpack 33l spacious interior multiple compartment rain cover laptop backpack men woman grey gift men woman kid college bag
https://www.amazon.in/SAFARI-Cherry-Casual-Backpack-DAYPACKNEO15CBCRE/dp/B07NSBSV2Y/ref=sr_1_151?crid=2M096C61O4MLT&dib=eyJ2IjoiMSJ9.sTGIt1-K-kqnHpuH9Y6Il9Prl2lCHrXE6b6IeUD3SoyuaQl-17L4cjd4nVqRHRupshWtj73qJC-xo6s18jjq4G45dUYjUI3C_90G9TWtPeIrawwUvRtOK-vqNTlGYSG0UeqVUmxJ6rkyDeY7eB0yoTbL23VI-k2RXlLIg2lXc1Mh-kwMDj_bzhLGiYl7eyddRDxd3BCKpyti0xE50SYbuvnvXHKJvMZLCxpWvOdUgJI.1oo95XOKxV_kzR3PsEMZtCLcdJtTz-RoDCm4VjJjGG0&dib_tag=se&keywords=bags&qid=1727241280&sprefix=ba%2Caps%2C283&sr=8-151,Safari 15 Litre Casual/School/College Standard Backpack - Cherry Red Small,₹475,4.1 out of 5 stars,"7,694","Safari Industries (India) Ltd, Safari Industries Ltd 301/302, A-Wing, The Qube, M.V.Road, Marol, Andheri(East), Near international Airport Mumbai- 400059 +91-22-40381851/838",B07NSBSV2Y,safari 15 litre casual school college standard backpack cherry red small
https://www.amazon.in/Shalimar-Premium-Garbage-Extra-Colour/dp/B07KSZTYWX/ref=sr_1_152?crid=2M096C61O4MLT&dib=eyJ2IjoiMSJ9.sTGIt1-K-kqnHpuH9Y6Il9Prl2lCHrXE6b6IeUD3SoyuaQl-17L4cjd4nVqRHRupshWtj73qJC-xo6s18jjq4G45dUYjUI3C_90G9TWtPeIrawwUvRtOK-vqNTlGYSG0UeqVUmxJ6rkyDeY7eB0yoTbL23VI-k2RXlLIg2lXc1Mh-kwMDj_bzhLGiYl7eyddRDxd3BCKpyti0xE50SYbuvnvXHKJvMZLCxpWvOdUgJI.1oo95XOKxV_kzR3PsEMZtCLcdJtTz-RoDCm4VjJjGG0&dib_tag=se&keywords=bags&qid=1727241280&sprefix=ba%2Caps%2C283&sr=8-152,Shalimar Premium Garbage Bags ( Lavender Fragrance ) Size 30 X 37 Inches (Extra Large) 60 Bags (4 rolls) Dustbin Bag/Trash Bag - Black Color,₹500,4.6 out of 5 stars,"1,684",Not found,Not found,shalimar premium garbage bag lavender fragrance size 30 x 37 inch extra large 60 bag 4 roll dustbin bag trash bag black color
https://www.amazon.in/Lavie-Extra-Large-Malnov-Womens/dp/B08LRFCBLW/ref=sr_1_153?crid=2M096C61O4MLT&dib=eyJ2IjoiMSJ9.sTGIt1-K-kqnHpuH9Y6Il9Prl2lCHrXE6b6IeUD3SoyuaQl-17L4cjd4nVqRHRupshWtj73qJC-xo6s18jjq4G45dUYjUI3C_90G9TWtPeIrawwUvRtOK-vqNTlGYSG0UeqVUmxJ6rkyDeY7eB0yoTbL23VI-k2RXlLIg2lXc1Mh-kwMDj_bzhLGiYl7eyddRDxd3BCKpyti0xE50SYbuvnvXHKJvMZLCxpWvOdUgJI.1oo95XOKxV_kzR3PsEMZtCLcdJtTz-RoDCm4VjJjGG0&dib_tag=se&keywords=bags&qid=1727241280&sprefix=ba%2Caps%2C283&sr=8-153,Lavie Women's Malnov Tote Bag | Ladies Purse Handbag,₹800,4.2 out of 5 stars,"5,815",Not found,Not found,lavie woman malnov tote bag lady purse handbag
https://www.amazon.in/LAXIS-Non-Woven-Moisture-Organiser-Size-45x33-5x22cm/dp/B0CC34XHB4/ref=sr_1_154?crid=2M096C61O4MLT&dib=eyJ2IjoiMSJ9.sTGIt1-K-kqnHpuH9Y6Il9Prl2lCHrXE6b6IeUD3SoyuaQl-17L4cjd4nVqRHRupshWtj73qJC-xo6s18jjq4G45dUYjUI3C_90G9TWtPeIrawwUvRtOK-vqNTlGYSG0UeqVUmxJ6rkyDeY7eB0yoTbL23VI-k2RXlLIg2lXc1Mh-kwMDj_bzhLGiYl7eyddRDxd3BCKpyti0xE50SYbuvnvXHKJvMZLCxpWvOdUgJI.1oo95XOKxV_kzR3PsEMZtCLcdJtTz-RoDCm4VjJjGG0&dib_tag=se&keywords=bags&qid=1727241280&sprefix=ba%2Caps%2C283&sr=8-154,LAXIS Saree Covers With Zip Non-Woven Printed Saree Cover/Saree Organizer For Wardrobe/Cloth Storage/Organizer With Transparent Window/Saree Bags Storage/Clothes Organizer (Blue- Pack of 3),₹175,4.0 out of 5 stars,"1,313",Not found,Not found,laxis saree cover zip non woven printed saree cover saree organizer wardrobe cloth storage organizer transparent window saree bag storage clothes organizer blue pack 3
https://www.amazon.in/Amazon-Brand-Presto-Oxo-Biodegradable-Garbage/dp/B0821QGBDY/ref=sr_1_155?crid=2M096C61O4MLT&dib=eyJ2IjoiMSJ9.sTGIt1-K-kqnHpuH9Y6Il9Prl2lCHrXE6b6IeUD3SoyuaQl-17L4cjd4nVqRHRupshWtj73qJC-xo6s18jjq4G45dUYjUI3C_90G9TWtPeIrawwUvRtOK-vqNTlGYSG0UeqVUmxJ6rkyDeY7eB0yoTbL23VI-k2RXlLIg2lXc1Mh-kwMDj_bzhLGiYl7eyddRDxd3BCKpyti0xE50SYbuvnvXHKJvMZLCxpWvOdUgJI.1oo95XOKxV_kzR3PsEMZtCLcdJtTz-RoDCm4VjJjGG0&dib_tag=se&keywords=bags&qid=1727241280&sprefix=ba%2Caps%2C283&sr=8-155,"Amazon Brand - Presto! Garbage Bags XL 60 Count|30 X 37 Inches Black , For Dry & Wet waste|10 bags/roll (Pack of 6)",₹449,4.4 out of 5 stars,"3,070",Not found,Not found,amazon brand presto garbage bag xl 60 count 30 x 37 inch black dry wet waste 10 bag roll pack 6
https://www.amazon.in/FUR-JADEN-Leatherette-Polypropylene-DUFF05/dp/B07M9BRCQ5/ref=sr_1_156?crid=2M096C61O4MLT&dib=eyJ2IjoiMSJ9.sTGIt1-K-kqnHpuH9Y6Il9Prl2lCHrXE6b6IeUD3SoyuaQl-17L4cjd4nVqRHRupshWtj73qJC-xo6s18jjq4G45dUYjUI3C_90G9TWtPeIrawwUvRtOK-vqNTlGYSG0UeqVUmxJ6rkyDeY7eB0yoTbL23VI-k2RXlLIg2lXc1Mh-kwMDj_bzhLGiYl7eyddRDxd3BCKpyti0xE50SYbuvnvXHKJvMZLCxpWvOdUgJI.1oo95XOKxV_kzR3PsEMZtCLcdJtTz-RoDCm4VjJjGG0&dib_tag=se&keywords=bags&qid=1727241280&sprefix=ba%2Caps%2C283&sr=8-156,Fur Jaden Brown Textured Leatherette Stylish & Spacious Weekender Duffle Bag for Travel for Men and Women,₹829,4.3 out of 5 stars,"9,038",Not found,Not found,fur jaden brown textured leatherette stylish spacious weekender duffle bag travel men woman
https://www.amazon.in/Resistance-Insulated-Tiffin-Storage-College/dp/B09XKGQYR3/ref=sr_1_157?crid=2M096C61O4MLT&dib=eyJ2IjoiMSJ9.sTGIt1-K-kqnHpuH9Y6Il9Prl2lCHrXE6b6IeUD3SoyuaQl-17L4cjd4nVqRHRupshWtj73qJC-xo6s18jjq4G45dUYjUI3C_90G9TWtPeIrawwUvRtOK-vqNTlGYSG0UeqVUmxJ6rkyDeY7eB0yoTbL23VI-k2RXlLIg2lXc1Mh-kwMDj_bzhLGiYl7eyddRDxd3BCKpyti0xE50SYbuvnvXHKJvMZLCxpWvOdUgJI.1oo95XOKxV_kzR3PsEMZtCLcdJtTz-RoDCm4VjJjGG0&dib_tag=se&keywords=bags&qid=1727241280&sprefix=ba%2Caps%2C283&sr=8-157,"Wooum Water Resistance Lunch Bag, Tiffin Bag, Travel Lunch Pouch, Food Storage Bag with Handle for Office, College, School, Picnic, Camping, Tiffin Box - Suitable for Unisex Adults and Children",₹397,4.3 out of 5 stars,"1,798",Not found,Not found,wooum water resistance lunch bag tiffin bag travel lunch pouch food storage bag handle office college school picnic camping tiffin box suitable unisex adult child
https://www.amazon.in/Shalimar-Premium-Garbage-Large-Dustbin/dp/B01NC2R52J/ref=sr_1_158?crid=2M096C61O4MLT&dib=eyJ2IjoiMSJ9.sTGIt1-K-kqnHpuH9Y6Il9Prl2lCHrXE6b6IeUD3SoyuaQl-17L4cjd4nVqRHRupshWtj73qJC-xo6s18jjq4G45dUYjUI3C_90G9TWtPeIrawwUvRtOK-vqNTlGYSG0UeqVUmxJ6rkyDeY7eB0yoTbL23VI-k2RXlLIg2lXc1Mh-kwMDj_bzhLGiYl7eyddRDxd3BCKpyti0xE50SYbuvnvXHKJvMZLCxpWvOdUgJI.1oo95XOKxV_kzR3PsEMZtCLcdJtTz-RoDCm4VjJjGG0&dib_tag=se&keywords=bags&qid=1727241280&sprefix=ba%2Caps%2C283&sr=8-158,Shalimar Premium Garbage Bags ( Lavender Fragrance ) Size 24 X 32 Inches (Large) 90 Bags (6 Rolls) Dustbin Bag/Trash Bag - Black Color,₹463,4.5 out of 5 stars,"4,699",Not found,Not found,shalimar premium garbage bag lavender fragrance size 24 x 32 inch large 90 bag 6 roll dustbin bag trash bag black color
https://www.amazon.in/Newtone-Premium-OXO-Biodegradable-Garbage/dp/B08M5C1YNJ/ref=sr_1_159?crid=2M096C61O4MLT&dib=eyJ2IjoiMSJ9.sTGIt1-K-kqnHpuH9Y6Il9Prl2lCHrXE6b6IeUD3SoyuaQl-17L4cjd4nVqRHRupshWtj73qJC-xo6s18jjq4G45dUYjUI3C_90G9TWtPeIrawwUvRtOK-vqNTlGYSG0UeqVUmxJ6rkyDeY7eB0yoTbL23VI-k2RXlLIg2lXc1Mh-kwMDj_bzhLGiYl7eyddRDxd3BCKpyti0xE50SYbuvnvXHKJvMZLCxpWvOdUgJI.1oo95XOKxV_kzR3PsEMZtCLcdJtTz-RoDCm4VjJjGG0&dib_tag=se&keywords=bags&qid=1727241280&sprefix=ba%2Caps%2C283&sr=8-159,Newtone Premium Garbage Bags Size 19 X 21 Inches (Medium) 120 Bags (4 Rolls) Dustbin Bag/Trash Bag - Green Color,₹221,4.3 out of 5 stars,285,Not found,Not found,newtone premium garbage bag size 19 x 21 inch medium 120 bag 4 roll dustbin bag trash bag green color
https://www.amazon.in/Shalimar-Premium-Jumbo-XL-Black/dp/B07BFBRH2N/ref=sr_1_160?crid=2M096C61O4MLT&dib=eyJ2IjoiMSJ9.sTGIt1-K-kqnHpuH9Y6Il9Prl2lCHrXE6b6IeUD3SoyuaQl-17L4cjd4nVqRHRupshWtj73qJC-xo6s18jjq4G45dUYjUI3C_90G9TWtPeIrawwUvRtOK-vqNTlGYSG0UeqVUmxJ6rkyDeY7eB0yoTbL23VI-k2RXlLIg2lXc1Mh-kwMDj_bzhLGiYl7eyddRDxd3BCKpyti0xE50SYbuvnvXHKJvMZLCxpWvOdUgJI.1oo95XOKxV_kzR3PsEMZtCLcdJtTz-RoDCm4VjJjGG0&dib_tag=se&keywords=bags&qid=1727241280&sprefix=ba%2Caps%2C283&sr=8-160,SHALIMAR Plastic Premium Garbage Bags Size 42 X 48 Inches (Jumbo XL) 30 Count (3 Rolls) Dustbin Bag/Trash Bag - Black Color,₹519,4.5 out of 5 stars,"2,199",Not found,Not found,shalimar plastic premium garbage bag size 42 x 48 inch jumbo xl 30 count 3 roll dustbin bag trash bag black color
https://www.amazon.in/Ezee-Biodegradable-Garbage-Medium-Dustbin/dp/B0CNGNYC46/ref=sr_1_209?crid=2M096C61O4MLT&dib=eyJ2IjoiMSJ9.Dre1QsY7ZO6c8VZNpIlNc9OGeXuJzbTzHoxSDjYtmFWRP1v0TTtBrGcutlcW60Y8VGUpODFMSLGIGd1GDAAq8Fjfjz22bAWYMFH_Ru1M3fVR6pDKPC20zLD13elJK7i8xOtiGYmBnjUIe59HRwM66hnpIg_5Oyd1ZOZDZs0MTyiq7J_YYTfPk-aDLvIpThfDWf6prYfHSOZzV2fJgcakPkOhmEkO1juFl1czM08mo08.PtpmtPkEceFh-qK5GDjR_g6Ungw086tI4vaBZXFr0eg&dib_tag=se&keywords=bags&qid=1727241298&sprefix=ba%2Caps%2C283&sr=8-209,Ezee Blue Garbage Bags Large 45 Pcs | 15 Pcs x Pack of 3 Rolls | 24 x 32 Inch | Dustbin Bags/Trash Bags/Dustbin Covers for Wet and Dry Waste,₹150,4.0 out of 5 stars,7,Not found,Not found,ezee blue garbage bag large 45 pc 15 pc x pack 3 roll 24 x 32 inch dustbin bag trash bag dustbin cover wet dry waste
https://www.amazon.in/MEDLER-Nylon-Expandable-Duffel-Trolley/dp/B07MWD4D4W/ref=sr_1_210?crid=2M096C61O4MLT&dib=eyJ2IjoiMSJ9.Dre1QsY7ZO6c8VZNpIlNc9OGeXuJzbTzHoxSDjYtmFWRP1v0TTtBrGcutlcW60Y8VGUpODFMSLGIGd1GDAAq8Fjfjz22bAWYMFH_Ru1M3fVR6pDKPC20zLD13elJK7i8xOtiGYmBnjUIe59HRwM66hnpIg_5Oyd1ZOZDZs0MTyiq7J_YYTfPk-aDLvIpThfDWf6prYfHSOZzV2fJgcakPkOhmEkO1juFl1czM08mo08.PtpmtPkEceFh-qK5GDjR_g6Ungw086tI4vaBZXFr0eg&dib_tag=se&keywords=bags&qid=1727241298&sprefix=ba%2Caps%2C283&sr=8-210,M MEDLER Epoch Nylon 55 litres Waterproof Strolley Duffle Bag- 2 Wheels - Luggage Bag - (Navy Blue),₹398,3.5 out of 5 stars,"29,150",Not found,Not found,medler epoch nylon 55 litre waterproof strolley duffle bag 2 wheel luggage bag navy blue
https://www.amazon.in/Wooum-Capacity-Shoulder-Messenger-Resistant/dp/B0D8FYCXL5/ref=sr_1_211?crid=2M096C61O4MLT&dib=eyJ2IjoiMSJ9.Dre1QsY7ZO6c8VZNpIlNc9OGeXuJzbTzHoxSDjYtmFWRP1v0TTtBrGcutlcW60Y8VGUpODFMSLGIGd1GDAAq8Fjfjz22bAWYMFH_Ru1M3fVR6pDKPC20zLD13elJK7i8xOtiGYmBnjUIe59HRwM66hnpIg_5Oyd1ZOZDZs0MTyiq7J_YYTfPk-aDLvIpThfDWf6prYfHSOZzV2fJgcakPkOhmEkO1juFl1czM08mo08.PtpmtPkEceFh-qK5GDjR_g6Ungw086tI4vaBZXFr0eg&dib_tag=se&keywords=bags&qid=1727241298&sprefix=ba%2Caps%2C283&sr=8-211,Wooum 14.1 Inch Laptop Holding Capacity One Side Bag Shoulder Bag Messenger Bag Office Bag/Travel Side Bag Water Resistant Material Travel Cross Body Bag,₹499,4.7 out of 5 stars,5,Not found,Not found,wooum 14 1 inch laptop holding capacity one side bag shoulder bag messenger bag office bag travel side bag water resistant material travel cross body bag
https://www.amazon.in/NORTH-ZONE-Waterproof-Backpack-Dimensions/dp/B0BS6QM2GD/ref=sr_1_212?crid=2M096C61O4MLT&dib=eyJ2IjoiMSJ9.Dre1QsY7ZO6c8VZNpIlNc9OGeXuJzbTzHoxSDjYtmFWRP1v0TTtBrGcutlcW60Y8VGUpODFMSLGIGd1GDAAq8Fjfjz22bAWYMFH_Ru1M3fVR6pDKPC20zLD13elJK7i8xOtiGYmBnjUIe59HRwM66hnpIg_5Oyd1ZOZDZs0MTyiq7J_YYTfPk-aDLvIpThfDWf6prYfHSOZzV2fJgcakPkOhmEkO1juFl1czM08mo08.PtpmtPkEceFh-qK5GDjR_g6Ungw086tI4vaBZXFr0eg&dib_tag=se&keywords=bags&qid=1727241298&sprefix=ba%2Caps%2C283&sr=8-212,NORTH ZONE Casual Waterproof Laptop Backpack/Office Bag/School Bag/College Bag/Business Bag/Travel Backpack (Dimensions:13x18 inches) (Compatible with 39.62cm(15.6inch laptop) 30 L,₹599,4.1 out of 5 stars,"1,340",Not found,Not found,north zone casual waterproof laptop backpack office bag school bag college bag business bag travel backpack dimension 13x18 inch compatible 39 62cm 15 6inch laptop 30 l
https://www.amazon.in/Wesley-Milestone-Waterproof-Backpack-Business/dp/B085S444JV/ref=sr_1_213?crid=2M096C61O4MLT&dib=eyJ2IjoiMSJ9.Dre1QsY7ZO6c8VZNpIlNc9OGeXuJzbTzHoxSDjYtmFWRP1v0TTtBrGcutlcW60Y8VGUpODFMSLGIGd1GDAAq8Fjfjz22bAWYMFH_Ru1M3fVR6pDKPC20zLD13elJK7i8xOtiGYmBnjUIe59HRwM66hnpIg_5Oyd1ZOZDZs0MTyiq7J_YYTfPk-aDLvIpThfDWf6prYfHSOZzV2fJgcakPkOhmEkO1juFl1czM08mo08.PtpmtPkEceFh-qK5GDjR_g6Ungw086tI4vaBZXFr0eg&dib_tag=se&keywords=bags&qid=1727241298&sprefix=ba%2Caps%2C283&sr=8-213,"Wesley Milestone 2.0 Casual Waterproof Laptop Backpack/Office Bag/School Bag/College Bag/Travel Backpack (Dimensions:13x18 inches) (Compatible with 39.62cm(15.6inch Laptop) 30 L, Charcoal Black",₹484,4.3 out of 5 stars,"16,776",Not found,Not found,wesley milestone 2 0 casual waterproof laptop backpack office bag school bag college bag travel backpack dimension 13x18 inch compatible 39 62cm 15 6inch laptop 30 l charcoal black
https://www.amazon.in/Aristocrat-Enigma-Polyester-Softsided-Duffle/dp/B0CWSCT2VJ/ref=sr_1_214?crid=2M096C61O4MLT&dib=eyJ2IjoiMSJ9.Dre1QsY7ZO6c8VZNpIlNc9OGeXuJzbTzHoxSDjYtmFWRP1v0TTtBrGcutlcW60Y8VGUpODFMSLGIGd1GDAAq8Fjfjz22bAWYMFH_Ru1M3fVR6pDKPC20zLD13elJK7i8xOtiGYmBnjUIe59HRwM66hnpIg_5Oyd1ZOZDZs0MTyiq7J_YYTfPk-aDLvIpThfDWf6prYfHSOZzV2fJgcakPkOhmEkO1juFl1czM08mo08.PtpmtPkEceFh-qK5GDjR_g6Ungw086tI4vaBZXFr0eg&dib_tag=se&keywords=bags&qid=1727241298&sprefix=ba%2Caps%2C283&sr=8-214,Aristocrat Enigma 52 Cm Polyester Softsided Cabin Size Duffle Bag - Red,₹468,4.0 out of 5 stars,63,Not found,Not found,aristocrat enigma 52 cm polyester softsided cabin size duffle bag red
https://www.amazon.in/Shalimar-Premium-Compostable-Biodegradable-Garbage/dp/B07KQDRSRS/ref=sr_1_215?crid=2M096C61O4MLT&dib=eyJ2IjoiMSJ9.Dre1QsY7ZO6c8VZNpIlNc9OGeXuJzbTzHoxSDjYtmFWRP1v0TTtBrGcutlcW60Y8VGUpODFMSLGIGd1GDAAq8Fjfjz22bAWYMFH_Ru1M3fVR6pDKPC20zLD13elJK7i8xOtiGYmBnjUIe59HRwM66hnpIg_5Oyd1ZOZDZs0MTyiq7J_YYTfPk-aDLvIpThfDWf6prYfHSOZzV2fJgcakPkOhmEkO1juFl1czM08mo08.PtpmtPkEceFh-qK5GDjR_g6Ungw086tI4vaBZXFr0eg&dib_tag=se&keywords=bags&qid=1727241298&sprefix=ba%2Caps%2C283&sr=8-215,Shalimar Compostable Garbage Bag Size 19 x 21 Inches (Medium) 45 Piece (3 Rolls) Dustbin Bag/Trash Bag - Green Color,₹323,4.2 out of 5 stars,"1,088",Not found,Not found,shalimar compostable garbage bag size 19 x 21 inch medium 45 piece 3 roll dustbin bag trash bag green color
https://www.amazon.in/Attractive-Waterproof-Backpack-Stylish-College/dp/B0D29QJTX2/ref=sr_1_216?crid=2M096C61O4MLT&dib=eyJ2IjoiMSJ9.Dre1QsY7ZO6c8VZNpIlNc9OGeXuJzbTzHoxSDjYtmFWRP1v0TTtBrGcutlcW60Y8VGUpODFMSLGIGd1GDAAq8Fjfjz22bAWYMFH_Ru1M3fVR6pDKPC20zLD13elJK7i8xOtiGYmBnjUIe59HRwM66hnpIg_5Oyd1ZOZDZs0MTyiq7J_YYTfPk-aDLvIpThfDWf6prYfHSOZzV2fJgcakPkOhmEkO1juFl1czM08mo08.PtpmtPkEceFh-qK5GDjR_g6Ungw086tI4vaBZXFr0eg&dib_tag=se&keywords=bags&qid=1727241298&sprefix=ba%2Caps%2C283&sr=8-216,ONEGO Attractive Light Weight & Waterproof Casual Backpack Stylish College bag School bag Laptop bag Office bag Tuition bag Daypack Bag for Men & Women Boys & Girls,₹399,4.0 out of 5 stars,2,Not found,Not found,onego attractive light weight waterproof casual backpack stylish college bag school bag laptop bag office bag tuition bag daypack bag men woman boy girl
